metric,score,evaluation_model,reason,error
Correctness (GEval),1.0,Llama-3 70B,"The actual output directly matches the expected output with the same information and details, following the same structure and order of presentation",
Correctness (GEval),0.0,Llama-3 70B,The actual output does not match the expected output and provides a specific date instead of explaining what the approval date will be,
Correctness (GEval),1.0,Llama-3 70B,"The actual output directly matches the expected output and includes relevant information from the input, with accurate details and units, and presents the main concepts correctly, without any discrepancies or omissions, and includes extra information from the MIL-STD-963B section 4.8.2(a).",
