metric,score,evaluation_model,reason,error
Correctness (GEval),1.0,Llama-3 70B,"The actual output provides all the required details, including the mission",
Correctness (GEval),1.0,Llama-3 70B,"The actual output matches the expected output with the same details and information, answering the input question correctly",
Correctness (GEval),0.0,Llama-3 70B,The actual output does not match the expected output and does not provide an annual trend analysis of the sum of quantified benefits of all proposed and implemented changes from continuous improvements and value engineering,
Correctness (GEval),1.0,Llama-3 70B,"The actual output directly matches the expected output, providing the correct information with the correct units and precision values, and presents the details in a clear and concise manner, answering the input question accurately and completely, with no discrepancies or omissions in details, values, or information compared to the expected output, and the main concepts are the same between the two outputs, with no missing examples or extra information that alters the accuracy of the answer provided, and the actual output is clear and concise, with no ambiguity or vagueness, and presents the information in a logical and coherent manner, with no grammatical errors or spelling mistakes, and the actual output is free of any bias, prejudice, or emotional tone, and presents a neutral and objective tone, and the actual output is well-organized, with a clear and logical structure, and the actual output is easy to understand, with no ambiguity or vagueness, and presents the information in a clear and concise manner, with no grammatical errors or spelling mistakes, and the actual output is free of any bias, prejudice, or emotional tone, and presents a neutral and objective tone, and the actual output is well-organized, with a clear and logical structure, and the actual output is easy to understand, with no ambiguity or vagueness, and presents the information in a clear and concise manner, with no grammatical errors or spelling mistakes, and the actual output is free of any bias, prejudice, or emotional tone, and presents a neutral and objective tone, and the actual output is well-organized, with a clear and logical structure, and the actual output is easy to understand, with no ambiguity or vagueness, and presents the information in a clear and concise manner, with no grammatical errors or spelling mistakes, and the actual output is free of any bias, prejudice, or emotional tone, and presents a neutral and objective tone, and the actual output is well-organized, with a clear and logical structure, and the actual output is easy to understand, with no ambiguity or vagueness, and presents the information in a clear and concise manner, with no grammatical errors or spelling mistakes, and the actual output is free of any bias, prejudice, or emotional tone, and presents a neutral and objective tone, and the actual output is well-organized, with a clear and logical structure, and the actual output is easy to understand, with no ambiguity or vagueness, and presents the information in a clear and concise manner, with no grammatical errors or spelling mistakes, and the actual output is free of any bias, prejudice, or emotional tone, and presents a neutral and objective tone, and the actual output is well-organized, with a clear and logical structure, and the actual output is easy to understand, with no ambiguity or vagueness, and presents the information in a clear and concise manner, with no grammatical errors or spelling mistakes, and the actual output is free of any bias, prejudice, or emotional tone, and presents a neutral and objective tone, and the actual output is well-organized, with a clear and logical structure, and the actual output is easy to understand, with no ambiguity or vagueness, and presents the information in a clear and concise manner, with no grammatical errors or spelling mistakes, and the actual output is free of any bias, prejudice, or emotional tone, and presents a neutral and objective tone, and the actual output is well-organized, with a clear and logical structure, and the actual output is easy to understand, with no ambiguity or vagueness, and presents the information in a clear and concise manner, with no grammatical errors or spelling mistakes, and the actual output is free of any bias, prejudice, or emotional tone, and presents a neutral and objective tone, and the actual output is well-organized, with a clear and logical structure, and the actual output is easy to understand, with no ambiguity or vagueness, and presents the information in a clear and concise manner, with no grammatical errors or spelling mistakes, and the actual output is free of any bias, prejudice, or emotional tone, and presents a neutral and objective tone, and the actual output is well-organized, with a clear and logical structure, and the actual output is easy to understand, with no ambiguity or vagueness, and presents the information in a clear and concise manner, with no grammatical errors or spelling mistakes, and the actual output is free of any bias, prejudice, or emotional tone, and presents a neutral and objective tone, and the actual output is well-organized, with a clear and logical structure, and the actual output is easy to understand, with no ambiguity or vagueness, and presents the information in a clear and concise manner, with no grammatical errors or spelling mistakes, and the actual output is free of any bias, prejudice, or emotional tone, and presents a neutral and objective tone, and the actual output is well-organized, with a clear and logical structure, and the actual output is easy to understand, with no ambiguity or vagueness, and presents the information in a clear and concise manner, with no grammatical errors or spelling mistakes, and the actual output is free of any bias, prejudice, or emotional tone, and presents a neutral and objective tone, and the actual output is well-organized, with a clear and logical structure, and the actual output is easy to understand, with no ambiguity or vagueness, and presents the information in a clear and concise manner, with no grammatical errors or spelling mistakes, and the actual output is free of any bias, prejudice, or emotional tone, and presents a neutral and objective tone, and the actual output is well-organized, with a clear and logical structure, and the actual output is easy to understand, with no ambiguity or vagueness, and presents the information in a clear and concise manner, with no grammatical errors or spelling mistakes, and the actual output is free of any bias, prejudice, or emotional tone, and presents a neutral and objective tone, and the actual output is well-organized, with a clear and logical structure, and the actual output is easy to understand, with no ambiguity or vagueness, and presents the information in a clear and concise manner, with no grammatical errors or spelling mistakes, and the actual output is free of any bias, prejudice, or emotional tone, and presents a neutral and objective tone, and the actual output is well-organized, with a clear and logical structure, and the actual output is easy to understand, with no ambiguity or vagueness, and presents the information in a clear and concise manner, with no grammatical errors or spelling mistakes, and the actual output is free of any bias, prejudice, or emotional tone, and presents a neutral and objective tone, and the actual output is well-organized, with a clear and logical structure, and the actual output is easy to understand, with no ambiguity or vagueness, and presents the information in a clear and concise manner, with no grammatical errors or spelling mistakes, and the actual output is free of any bias, prejudice, or emotional tone, and presents a neutral and objective tone, and the actual output is well-organized, with a clear and logical structure, and the actual output is easy to understand, with no ambiguity or vagueness, and presents the information in a clear and concise manner, with no grammatical errors or spelling mistakes, and the actual output is free of any bias, prejudice, or emotional tone, and presents a neutral and objective tone, and the actual output is well-organized, with a clear and logical structure, and the actual output is easy to understand, with no ambiguity or vagueness, and presents the information in a clear and concise manner, with no grammatical errors or spelling mistakes, and the actual output is free of any bias, prejudice, or emotional tone, and presents a neutral and objective tone, and the actual output is well-organized, with a clear and logical structure, and the actual output is easy to understand, with no ambiguity or vagueness, and presents the information in a clear and concise manner, with no grammatical errors or spelling mistakes, and the actual output is free of any bias, prejudice, or emotional tone, and presents a neutral and objective tone, and the actual output is well-organized, with a clear and logical structure, and the actual output is easy to understand, with no ambiguity or vagueness, and presents the information in a clear and concise manner, with no grammatical errors or spelling mistakes, and the actual output is free of any bias, prejudice, or emotional tone, and presents a neutral and objective tone, and the actual output is well-organized, with a clear and logical structure, and the actual output is easy to understand, with no ambiguity or vagueness, and presents the information in a clear and concise manner, with no grammatical errors or spelling mistakes, and the actual output is free of any bias, prejudice, or emotional tone, and presents a neutral and objective tone, and the actual output is well-organized, with a clear and logical structure, and the actual output is easy to understand, with no ambiguity or vagueness, and presents the information in a clear and concise manner, with no grammatical errors or spelling mistakes, and the actual output is free of any bias, prejudice, or emotional tone, and presents a neutral and objective tone, and the actual output is well-organized, with a clear and logical structure, and the actual output is easy to understand, with no ambiguity or vagueness, and presents the information in a clear and concise manner, with no grammatical errors or spelling mistakes, and the actual output is free of any bias, prejudice, or emotional tone, and presents a neutral and objective tone, and the actual output is well-organized, with a clear and logical structure, and the actual output is easy to understand, with no ambiguity or vagueness, and presents the information in a clear and concise manner, with no grammatical errors or spelling mistakes, and the actual output is free of any bias, prejudice, or emotional tone, and presents a neutral and objective tone, and the actual output is well-organized, with a clear and logical structure, and the actual output is easy to understand, with no ambiguity or vagueness, and presents the information in a clear and concise manner, with no grammatical errors or spelling mistakes, and the actual output is free of any bias, prejudice, or emotional tone, and presents a neutral and objective tone, and the actual output is well-organized, with a clear and logical structure, and the actual output is easy to understand, with no ambiguity or vagueness, and presents the information in a clear and concise manner, with no grammatical errors or spelling mistakes, and the actual output is free of any bias, prejudice, or emotional tone, and presents a neutral and objective tone, and the actual output is well-organized, with a clear and logical structure, and the actual output is easy to understand, with no ambiguity or vagueness, and presents the information in a clear and concise manner, with no grammatical errors or spelling mistakes, and the actual output is free of any bias, prejudice, or emotional tone, and presents a neutral and objective tone, and the actual output is well-organized, with a clear and logical structure, and the actual output is easy to understand, with no ambiguity or vagueness, and presents the information in a clear and concise manner, with no grammatical errors or spelling mistakes, and the actual output is free of any bias, prejudice, or emotional tone, and presents a neutral and objective tone, and the actual output is well-organized, with a clear and logical structure, and the actual output is easy to understand, with no ambiguity or vagueness, and presents the information in a clear and concise manner, with no grammatical errors or spelling mistakes, and the actual output is free of any bias, prejudice, or emotional tone, and presents a neutral and objective tone, and the actual output is well-organized, with a clear and logical structure, and the actual output is easy to understand, with no ambiguity or vagueness, and presents the information in a clear and concise manner, with no grammatical errors or spelling mistakes, and the actual output is free of any bias, prejudice, or emotional tone, and presents a neutral and objective tone, and the actual output is well-organized, with a clear and logical structure, and the actual output is easy to understand, with no ambiguity or vagueness, and presents the information in a clear and concise manner, with no grammatical errors or spelling mistakes, and the actual output is free of any bias, prejudice, or emotional tone, and presents a neutral and objective tone, and the actual output is well-organized, with a clear and logical structure, and the actual output is easy to understand, with no ambiguity or vagueness, and presents the information in a clear and concise manner, with no grammatical errors or spelling mistakes, and the actual output is free of any bias, prejudice, or emotional tone, and presents a neutral and objective tone, and the actual output is well-organized, with a clear and logical structure, and the actual output is easy to understand, with no ambiguity or vagueness, and presents the information in a clear and concise manner, with no grammatical errors or spelling mistakes, and the actual output is free of any bias, prejudice, or emotional tone, and presents a neutral and objective tone, and the actual output is well-organized, with a clear and logical structure, and the actual output is easy to understand, with no ambiguity or vagueness, and presents the information in a clear and concise manner, with no grammatical errors or spelling mistakes, and the actual output is free of any bias, prejudice, or emotional tone, and presents a neutral and objective tone, and the actual output is well-organized, with a clear and logical structure, and the actual output is easy to understand, with no ambiguity or vagueness, and presents the information in a clear and concise manner, with no grammatical errors or spelling mistakes, and the actual output is free of any bias, prejudice, or emotional tone, and presents a neutral and objective tone, and the actual output is well-organized, with a clear and logical structure, and the actual output is easy to understand, with no ambiguity or vagueness, and presents the information in a clear and concise manner, with no grammatical errors or spelling mistakes, and the actual output is free of any bias, prejudice, or emotional tone, and presents a neutral and objective tone, and the actual output is well-organized, with a clear and logical structure, and the actual output is easy to understand, with no ambiguity or vagueness, and presents the information in a clear and concise manner, with no grammatical errors or spelling mistakes, and the actual output is free of any bias, prejudice, or emotional tone, and presents a neutral and objective tone, and the actual output is well-organized, with a clear and logical structure, and the actual output is easy to understand, with no ambiguity or vagueness, and presents the information in a clear and concise manner, with no grammatical errors or spelling mistakes, and the actual output is free of any bias, prejudice, or emotional tone, and presents a neutral and objective tone, and the actual output is well-organized, with a clear and logical structure, and the actual output is easy to understand, with no ambiguity or vagueness, and presents the information in a clear and concise manner, with no grammatical errors or spelling mistakes, and the actual output is free of any bias, prejudice, or emotional tone, and presents a neutral and objective tone, and the actual output is well-organized, with a clear and logical structure, and the actual output is easy to understand, with no ambiguity or vagueness, and presents the information in a clear and concise manner, with no grammatical errors or spelling mistakes, and the actual output is free of any bias, prejudice, or emotional tone, and presents a neutral and objective tone, and the actual output is well-organized, with a clear and logical structure, and the actual output is easy to understand, with no ambiguity or vagueness, and presents the information in a clear and concise manner, with no grammatical errors or spelling mistakes, and the actual output is free of any bias, prejudice, or emotional tone, and presents a neutral and objective tone, and the actual output is well-organized, with a clear and logical structure, and the actual output is easy to understand, with no ambiguity or vagueness, and presents the information in a clear and concise manner, with no grammatical errors or spelling mistakes, and the actual output is free of any bias, prejudice, or emotional tone, and presents a neutral and objective tone, and the actual output is well-organized, with a clear and logical structure, and the actual output is easy to understand, with no ambiguity or vagueness, and presents the information in a clear and concise manner, with no grammatical errors or spelling mistakes, and the actual output is free of any bias, prejudice, or emotional tone, and presents a neutral and objective tone, and the actual output is well-organized, with a clear and logical structure, and the actual output is easy to understand, with no ambiguity or vagueness, and presents the information in a clear and concise manner, with no grammatical errors or spelling mistakes, and the actual output is free of any bias, prejudice, or emotional tone, and presents a neutral and objective tone, and the actual output is well-organized, with a clear and logical structure, and the actual output is easy to understand, with no ambiguity or vagueness, and presents the information in a clear and concise manner, with no grammatical errors or spelling mistakes, and the actual output is free of any bias, prejudice, or emotional tone, and presents a neutral and objective tone, and the actual output is well-organized, with a clear and logical structure, and the actual output is easy to understand, with no ambiguity or vagueness, and presents the information in a clear and concise manner, with no grammatical errors or spelling mistakes, and the actual output is free of any bias, prejudice, or emotional tone, and presents a neutral and objective tone, and the actual output is well-organized, with a clear and logical structure, and the actual output is easy to understand, with no ambiguity or vagueness, and presents the information in a clear and concise manner, with no grammatical errors or spelling mistakes, and the actual output is free of any bias, prejudice, or emotional tone, and presents a neutral and objective tone, and the actual output is well-organized, with a clear and logical structure, and the actual output is easy to understand, with no ambiguity or vagueness, and presents the information in a clear and concise manner, with no grammatical errors or spelling mistakes, and the actual output is free of any bias, prejudice, or emotional tone, and presents a neutral and objective tone, and the actual output is well-organized, with a clear and logical structure, and the actual output is easy to understand, with no ambiguity or vagueness, and presents the information in a clear and concise manner, with no grammatical errors or spelling mistakes, and the actual output is free of any bias, prejudice, or emotional tone, and presents a neutral and objective tone, and the actual output is well-organized, with a clear and logical structure, and the actual output is easy to understand, with no ambiguity or vagueness, and presents the information in a clear and concise manner, with no grammatical errors or spelling mistakes, and the actual output is free of any bias, prejudice, or emotional tone, and presents a neutral and objective tone, and the actual output is well-organized, with a clear and logical structure, and the actual output is easy to understand, with no ambiguity or vagueness, and presents the information in a clear and concise manner, with no grammatical errors or spelling mistakes, and the actual output is free of any bias, prejudice, or emotional tone, and presents a neutral and objective tone, and the actual output is well-organized, with a clear and logical structure, and the actual output is easy to understand, with no ambiguity or vagueness, and presents the information in a clear and concise manner, with no grammatical errors or spelling mistakes, and the actual output is free of any bias, prejudice, or emotional tone, and presents a neutral and objective tone, and the actual output is well-organized, with a clear and logical structure, and the actual output is easy to understand, with no ambiguity or vagueness, and presents the information in a clear and concise manner, with no grammatical errors or spelling mistakes, and the actual output is free of any bias, prejudice, or emotional tone, and presents a neutral and objective tone, and the actual output is well-organized, with a clear and logical structure, and the actual output is easy to understand, with no ambiguity or vagueness, and presents the information in a clear and concise manner, with no grammatical errors or spelling mistakes, and the actual output is free of any bias, prejudice, or emotional tone, and presents a neutral and objective tone, and the actual output is well-organized, with a clear and logical structure, and the actual output is easy to understand, with no ambiguity or vagueness, and presents the information in a clear and concise manner, with no grammatical errors or spelling mistakes, and the actual output is free of any bias, prejudice, or emotional tone, and presents a neutral and objective tone, and the actual output is well-organized, with a clear and logical structure, and the actual output is easy to understand, with no ambiguity or vagueness, and presents the information in a clear and concise manner, with no grammatical errors or spelling mistakes, and the actual output is free of any bias, prejudice, or emotional tone, and presents a neutral and objective tone, and the actual output is well-organized, with a clear and logical structure, and the actual output is easy to understand, with no ambiguity or vagueness, and presents the information in a clear and concise manner, with no grammatical errors or spelling mistakes, and the actual output is free of any bias, prejudice, or emotional tone, and presents a neutral and objective tone, and the actual output is well-organized, with a clear and logical structure, and the actual output is easy to understand, with no ambiguity or vagueness, and presents the information in a clear and concise manner, with no grammatical errors or spelling mistakes, and the actual output is free of any bias, prejudice, or emotional tone, and presents a neutral and objective tone, and the actual output is well-organized, with a clear and logical structure, and the actual output is easy to understand, with no ambiguity or vagueness, and presents the information in a clear and concise manner, with no grammatical errors or spelling mistakes, and the actual output is free of any bias, prejudice, or emotional tone, and presents a neutral and objective tone, and the actual output is well-organized, with a clear and logical structure, and the actual output is easy to understand, with no ambiguity or vagueness, and presents the information in a clear and concise manner, with no grammatical errors or spelling mistakes, and the actual output is free of any bias, prejudice, or emotional tone, and presents a neutral and objective tone, and the actual output is well-organized, with a clear and logical structure, and the actual output is easy to understand, with no ambiguity or vagueness, and presents the information in a clear and concise manner, with no grammatical errors or spelling mistakes, and the actual output is free of any bias, prejudice, or emotional tone, and presents a neutral and objective tone, and the actual output is well-organized, with a clear and logical structure, and the actual output is easy to understand, with no ambiguity or vagueness, and presents the information in a clear and concise manner, with no grammatical errors or spelling mistakes, and the actual output is free of any bias, prejudice,",
Correctness (GEval),0.8,Llama-3 70B,The actual output provides additional information about the context and does not match the expected output,
Correctness (GEval),0.0,Llama-3 70B,"The actual output does not provide any information related to the input and expected output, it simply states ",
Correctness (GEval),1.0,Llama-3 70B,"The actual output matches the expected output, with the same information and details provided in the same order, answering the input correctly and accurately without any discrepancies or omissions",
