metric,score,evaluation_model,reason,error
Contextual Precision,1.0,Llama-3 70B,"The score is 1.00 because all irrelevant nodes in the retrieval context, such as the 2nd node with reason ",
Contextual Precision,0.5,Llama-3 70B,"The score is 0.50 because half of the top-ranked nodes in the retrieval context are irrelevant to the input, such as the first node which discusses terrain values and surface roughness conditions, and the fourth and fifth nodes which do not provide information about the Lunar Exploration Light Rover",
Contextual Precision,0.6,Llama-3 70B,"The score is 0.60 because the top-ranked node is relevant, but then there are 7 irrelevant nodes in retrieval context ranked higher than the 2nd relevant node, which is ranked 10th. The irrelevant nodes, such as node 2, which talks about the rationale for handling commands from multiple sources under debugging conditions, should be ranked lower than the relevant nodes, such as node 1, which mentions the Site Operations Center is for",
Contextual Precision,1.0,Llama-3 70B,"The score is 1.00 because all the relevant nodes, like node 1 which mentions ",
Contextual Precision,0.0,Llama-3 70B,"The score is 0.00 because the only node in the retrieval context is ranked first but has an irrelevant node with a reason that the passage does not mention the launch vehicle of the Rosetta spacecraft, it only provides information about the mission itself and its objectives, indicating that the model failed to prioritize relevant information over irrelevant ones.",
Contextual Precision,0.0,Llama-3 70B,"The score is 0.00 because all the nodes in the retrieval context are irrelevant to the input, with the first node stating ",
Contextual Precision,0.0,Llama-3 70B,"The score is 0.00 because all nodes in the retrieval context are irrelevant to the input, with the first node stating ",
Contextual Precision,0.5,Llama-3 70B,"The score is 0.50 because the relevant node at rank 2 is correctly ranked higher than the irrelevant nodes at ranks 1, 3, 4, 5, 6, 7, 8, 9, but there are too many irrelevant nodes ranked higher than the relevant node, which should be ranked lower. For instance, the node at rank 1 is irrelevant as it ",
Contextual Precision,0.0,Llama-3 70B,"The score is 0.00 because all the nodes in the retrieval context are ranked as irrelevant, with the first node stating ",
Contextual Precision,0.3333333333333333,Llama-3 70B,"The score is 0.33 because the relevant node at rank 3 is correctly ranked higher than the irrelevant nodes at ranks 1, 2, 4, 5, 6, 7, 8, and 9, but the irrelevant nodes are still ranked relatively high, suggesting that the model is not effectively distinguishing between relevant and irrelevant nodes. The reason for the ",
Contextual Precision,1.0,Llama-3 70B,"The score is 1.00 because all relevant nodes in the retrieval context are ranked higher than irrelevant nodes. The top-ranked node directly answers the question, and all other nodes are correctly placed at lower ranks due to their lack of information about failure tolerance and protection circuitry, as stated in their respective reasons starting from rank 2 onwards.",
Contextual Precision,0.05263157894736842,Llama-3 70B,"The score is 0.05 because the irrelevant nodes in the retrieval context, such as the 1st node, 2nd node, 3rd node,..., 21st node, were ranked higher than the relevant node, with reasons like ",
Contextual Precision,0.3333333333333333,Llama-3 70B,"The score is 0.33 because the relevant nodes, such as the 3rd node that mentions the Otawara fly-by and Siwa fly-by, are not consistently ranked higher than the irrelevant nodes. For example, the 1st and 2nd nodes do not provide information about the spacecraft",
Contextual Precision,0.0,Llama-3 70B,"The score is 0.00 because all the nodes in the retrieval context are irrelevant to the input, with the top-ranked node (rank 1) talking about ",
Contextual Precision,1.0,Llama-3 70B,"The score is 1.00 because all irrelevant nodes in the retrieval context, starting from the second node, are correctly ranked lower than the relevant node at rank 1, which explicitly states the tool",
Contextual Precision,0.125,Llama-3 70B,"The score is 0.12 because the first 7 nodes in the retrieval context, which are irrelevant to the input, are ranked higher than the relevant node, which is ranked 8th. The irrelevant nodes have reasons such as ",
Contextual Precision,1.0,Llama-3 70B,"The score is 1.00 because all irrelevant nodes, such as node 2 with reason ",
Contextual Precision,0.3333333333333333,Llama-3 70B,"The score is 0.33 because two out of the first three nodes in the retrieval context, nodes 1 and 2, are irrelevant to the input and are ranked higher than the relevant node 3, which explicitly states the answer to the question, resulting in a lower score.",
Contextual Precision,1.0,Llama-3 70B,"The score is 1.00 because all relevant nodes in the retrieval context are ranked higher than the irrelevant nodes. The first two nodes, which are ranked 1 and 2, directly discuss the proof-testing of standard potted inserts up to 110% of their allowable loads, providing strong evidence for the input query. The remaining nodes, ranked 3-10, are irrelevant as they discuss unrelated topics such as document information, material safety factors, and design loads, which are not directly related to the topic of proof-testing standard potted inserts. Therefore, the model has perfectly distinguished between relevant and irrelevant nodes, resulting in a perfect contextual precision score of 1.00.",
Contextual Precision,0.8099999999999999,Llama-3 70B,"The score is 0.81 because the top-ranked nodes in the retrieval context are generally relevant to the input, with the first, third, fourth, fifth, and sixth nodes providing direct explanations for why a chain of evidence might be inadequate, whereas the second and seventh nodes are less relevant and should be ranked lower. However, the model",
Contextual Precision,1.0,Llama-3 70B,"The score is 1.00 because all the relevant nodes in the retrieval context are ranked higher than the irrelevant nodes. The first node, which is directly addressing the question, is correctly ranked as the most relevant, and the subsequent nodes, which do not provide any relevant information related to the design task in WP6, are correctly ranked lower. The ranking is perfect, with all the ",
Contextual Precision,1.0,Llama-3 70B,"The score is 1.00 because all the nodes in the retrieval context are relevant to the input and are ranked in the correct order, with the most relevant nodes at the top. The first node directly addresses the design of the evidence management service infrastructure, the second node explains the importance of evidence management, and so on, making all nodes highly relevant to the input. Therefore, the score is perfect, indicating that the model is able to accurately rank the nodes in the correct order of relevance to the input.",
Contextual Precision,0.0,Llama-3 70B,"The score is 0.00 because all nodes in the retrieval context are irrelevant to the input, with the first node stating that ",
Contextual Precision,0.3333333333333333,Llama-3 70B,"The score is 0.33 because two irrelevant nodes, ranked 1 and 2, should be ranked lower than the relevant node, ranked 3, which explains the process of evidence management, implying multiple steps involved in the overall approach. The irrelevant node, ranked 4, is correctly ranked lower than the relevant node, but the overall ranking could be improved.",
Contextual Precision,1.0,Llama-3 70B,"The score is 1.00 because all irrelevant nodes are correctly ranked lower than the relevant node, which is the first node in the retrieval context. The first node is ranked highest as it directly answers the question, while the rest of the nodes are irrelevant and therefore ranked lower. This perfect ranking is the reason for the perfect score of 1.00",
Contextual Precision,1.0,Llama-3 70B,"The score is 1.00 because all irrelevant nodes in the retrieval context, starting from node 2, are correctly ranked lower than the relevant node at rank 1, which clearly states that two systems can have the same functionality. This perfect ranking results in a perfect score of 1.00. Well done model!",
Contextual Precision,1.0,Llama-3 70B,"The score is 1.00 because all relevant nodes in the retrieval context, including the first node explaining the approach through analysis of previous deliverables, the second node about discovering requirements, the third node highlighting abstraction level, and the fourth node showing proposed actions to apply RAM, are ranked higher than the irrelevant node at rank 5, which discusses compiler and other unrelated topics, ensuring perfect contextual precision.",
Contextual Precision,1.0,Llama-3 70B,"The score is 1.00 because the only relevant node in the retrieval context, ranked 1, explicitly mentions the functional areas of the OPENCOSS platform in the section ",
Contextual Precision,0.0,Llama-3 70B,"The score is 0.00 because all nodes in the retrieval context, ranked from 1 to 20, are irrelevant to the input, with reasons such as ",
Contextual Precision,1.0,Llama-3 70B,"The score is 1.00 because all the irrelevant nodes in the retrieval context, starting from the second node, were correctly ranked lower than the relevant node at rank 1, which provides a clear explanation for the zoom requirement of the rover. This perfect ranking is a testament to the model",
Contextual Precision,1.0,Llama-3 70B,"The score is 1.00 because all irrelevant nodes in the retrieval context, from rank 2 to 20, do not mention anything about the location of the Lunar Exploration Light Rover in relation to the question, making them correctly ranked lower than the first node, which directly answers the question about the location of the Lunar Exploration Light Rover, which is the Exploration Development and Operations Center, as stated in its reason: ",
Contextual Precision,1.0,Llama-3 70B,"The score is 1.00 because all irrelevant nodes in the retrieval context are correctly ranked lower than the relevant node, which is the first node, stating that ",
Contextual Precision,0.125,Llama-3 70B,"The score is 0.12 because there are many irrelevant nodes in the retrieval context that are ranked higher than the relevant node, such as node 1 which discusses Ackerman angles and steering mechanisms, node 2 which talks about soil characteristics, and node 3 which provides a formula for calculating Mean Maximum Pressure (MMP) for wheeled vehicles. These nodes are not directly related to the question about wheeled vehicle degrees, but are ranked above the relevant node 8 which mentions ",
Contextual Precision,1.0,Llama-3 70B,"The score is 1.00 because all relevant nodes, like node 1 which directly addresses the question, are ranked higher than irrelevant nodes, such as node 2, 3, 4, 5, 6, 7, 8, which do not relate to the angle of the ramp breakover, ensuring a perfect ranking order. This indicates a flawless retrieval context ranking system that prioritizes relevant information over irrelevant ones, resulting in a perfect contextual precision score of 1.00.",
Contextual Precision,0.16666666666666666,Llama-3 70B,"The score is 0.17 because the irrelevant nodes in retrieval contexts, such as node 1, node 2, node 3, node 4, and node 5, are ranked higher than the relevant node, node 6, which directly answers the question. The irrelevant nodes do not provide any information about absolute pointing error, whereas node 6 clearly defines it. This mismatch in ranking is the main reason for the low score. However, it is not zero because node 6 is still ranked relatively high, indicating some level of contextual precision.",
Contextual Precision,0.2,Llama-3 70B,"The score is 0.20 because the first four nodes in the retrieval context, which are irrelevant to the input, are ranked higher than the relevant node at rank 5. The reasons for these ",
Contextual Precision,1.0,Llama-3 70B,"The score is 1.00 because all irrelevant nodes in the retrieval context, such as nodes 2 to 7, are correctly ranked lower than the relevant node at rank 1, which directly addresses the question of absolute measurement error with a clear definition, ensuring the highest possible precision score.",
Contextual Precision,0.14285714285714285,Llama-3 70B,"The score is 0.14 because the top 6 nodes in the retrieval context are irrelevant to the input, with reasons such as ",
Contextual Precision,0.125,Llama-3 70B,"The score is 0.12 because the relevant node at rank 8 is ranked lower than the 7 irrelevant nodes that come before it, with reasons such as ",
Contextual Precision,0.0,Llama-3 70B,"The score is 0.00 because all nodes in the retrieval context, including the first node, second node, third node, and so on, do not mention ",
Contextual Precision,1.0,Llama-3 70B,"The score is 1.00 because all irrelevant nodes, starting from the second node, were correctly ranked lower than the first node which explicitly states that the spacecraft will be used to orbit the comet Wirtanen, as quoted in the reason ",
Contextual Precision,0.14285714285714285,Llama-3 70B,"The score is 0.14 because the first six nodes in the retrieval context, which are irrelevant to the input, are ranked higher than the relevant node at rank 7, which mentions ",
Contextual Precision,0.8333333333333333,Llama-3 70B,"The score is 0.83 because the first and third nodes in the retrieval context are relevant to the input, ranking higher than the irrelevant nodes, but there are many irrelevant nodes ranked lower, which prevents the score from being higher. The irrelevant nodes, such as the second node talking about software requirements specification for KeePass Password Safe, are correctly ranked lower than the relevant nodes, but their sheer number brings the score down. Overall, the model is doing a good job of distinguishing between relevant and irrelevant nodes, but there is room for improvement in ranking the irrelevant nodes even lower.",
Contextual Precision,0.3333333333333333,Llama-3 70B,"The score is 0.33 because only 2 out of 6 nodes in the retrieval context are directly relevant to the input, and they are ranked 3rd and 6th. The irrelevant nodes, such as the 1st node talking about the document",
Contextual Precision,0.3333333333333333,Llama-3 70B,"The score is 0.33 because only one relevant node (rank 3) is ranked higher than the irrelevant nodes (ranks 1, 2, 4, 5). The irrelevant nodes, such as the first node, which only provides a document number and issue/rev number, date, and page number, without any relevant information about the mission or comet Wirtanen, and the fourth node, which discusses the spacecraft",
Contextual Precision,0.25,Llama-3 70B,"The score is 0.25 because the relevant node at rank 4 is ranked lower than many irrelevant nodes. For example, the node at rank 1 has a reason ",
Contextual Precision,1.0,Llama-3 70B,"The score is 1.00 because the first node in the retrieval context, which clearly states the prohibited items by the Rosetta programming standard, is correctly ranked as the most relevant, and all the irrelevant nodes, which do not provide any information related to the question being asked, are correctly ranked lower, resulting in a perfect contextual precision score.",
Contextual Precision,1.0,Llama-3 70B,"The score is 1.00 because all irrelevant nodes in the retrieval context are correctly ranked lower than the relevant node at rank 1, which provides valuable information about the confidence level of the fly-by, specifically mentioning a motorisation factor related to it and inferring a 95% confidence level based on the provided context. This perfect ranking ensures that the most relevant information is presented first, making it easy to find the desired answer.",
Contextual Precision,1.0,Llama-3 70B,"The score is 1.00 because all the irrelevant nodes in the retrieval context, ranked 2 to 10, do not provide any relevant information about the payload line of sight cone angle, and are correctly ranked lower than the relevant node at rank 1, which explicitly states the pointing error of the payload line of sight in multiple phases, including asteroid and comet detection phase, which mentions 0.3 deg half cone angle, matching the expected output ",
Contextual Precision,1.0,Llama-3 70B,"The score is 1.00 because the only relevant node in the retrieval context, ranked 1, directly answers the question about the confidence level in the asteroid fly-by phase, and all the other nodes, ranked 2-9, are irrelevant and do not provide information about the confidence level in the asteroid fly-by phase, thus the relevant node is ranked higher than the irrelevant nodes, resulting in a perfect score.",
Contextual Precision,0.0,Llama-3 70B,"The score is 0.00 because all nodes in the retrieval context, including the first, second, third, fourth, fifth, sixth, seventh, eighth, and ninth nodes, are irrelevant to the input, as they only discuss attitude control and spacecraft operations during the cruise phase of the Rosetta mission, which is unrelated to the topic of propellants, and therefore should be ranked lower than relevant nodes, but there are no relevant nodes in this retrieval context, resulting in a score of 0.00",
Contextual Precision,1.0,Llama-3 70B,"The score is 1.00 because the single retrieval context node at rank 1 directly answers the input question, making it perfectly ranked for maximum precision.",
Contextual Precision,0.16666666666666666,Llama-3 70B,"The score is 0.17 because the relevant node at rank 6 is correctly ranked higher than the first 5 irrelevant nodes, which are not related to the question about providing Engineering Change Proposals for proposed changes that do not change the form, fit and function of the HCCS EG. However, the irrelevant nodes at ranks 7-20 are not correctly ranked lower than the relevant node, which is why the score is not higher. For example, the node at rank 7 is about Engineering Change Development, which is not related to the question, and should be ranked lower than the relevant node at rank 6. Similarly, the node at rank 8 is about developing ECs using systems engineering processes, which is also not related to the question, and should be ranked lower than the relevant node at rank 6. This pattern continues for the remaining irrelevant nodes, which is why the score is not higher than 0.17.",
Contextual Precision,1.0,Llama-3 70B,"The score is 1.00 because all irrelevant nodes in the retrieval context, from rank 2 to 20, do not provide any information about the performance indicators the Contractor must quantify, and are correctly ranked lower than the relevant node at rank 1, which directly addresses the question by stating the Contractor must quantify the benefits of all proposed and implemented changes from continuous improvements and value engineering to support the performance indicators.",
Contextual Precision,0.08388157894736842,Llama-3 70B,"The score is 0.08 because the top-ranked nodes in the retrieval context are mostly irrelevant to the input question, with the first 14 nodes not providing a clear answer to the question at hand, and only nodes ranked 15 and 24 providing relevant information about assistance to RCN Units. The irrelevant nodes, such as the 1st node discussing roles and responsibilities of formations and units, the 2nd node discussing direct liaison between the Contractor and Units/Formations, and the 3rd node discussing assignment of individual ships to specific readiness levels, are ranked higher than the relevant nodes, which is why the score is not higher.",
Contextual Precision,1.0,Llama-3 70B,"The score is 1.00 because the first node in the retrieval context directly answers the question about what a Maintenance Plan is, and all the irrelevant nodes are correctly ranked lower, which demonstrates a perfect ranking of relevant nodes over irrelevant ones. This is a fantastic outcome, indicating that the model is working flawlessly in this case!",
Contextual Precision,0.0,Llama-3 70B,"The score is 0.00 because there are no retrieval contexts provided, hence no relevant nodes to rank higher than irrelevant nodes in the given retrieval contexts list, resulting in a precision score of 0.00",
Contextual Precision,1.0,Llama-3 70B,"The score is 1.00 because the first node in the retrieval context, which is highly relevant, is ranked as the top result. All other nodes are correctly ranked lower as they do not provide any information about who shall provide engineering support of EC installations conducted by DND, as stated in their reasons. This perfect ranking demonstrates exceptional contextual precision, showcasing a seamless understanding of relevance in the retrieval context.",
Contextual Precision,1.0,Llama-3 70B,"The score is 1.00 because all irrelevant nodes, starting from the second node, are correctly ranked lower than the first node, which directly addresses the input question about procedures used to support EC installations, demonstrating perfect contextual precision.",
Contextual Precision,0.0,Llama-3 70B,"The score is 0.00 because there are no retrieval contexts provided, so it is impossible to determine the relevance of any nodes in the retrieval context to the input query, resulting in a score of 0.00",
Contextual Precision,1.0,Llama-3 70B,"The score is 1.00 because all relevant nodes in the retrieval context are correctly ranked higher than the irrelevant nodes, as seen in the first node which directly answers the question, and the irrelevant nodes are correctly ranked lower, such as the second, third and fourth nodes which do not provide any information about the number of systems retrofitted to the Halifax-class Combat Systems, thus achieving a perfect ranking and resulting in a score of 1.00.",
Contextual Precision,1.0,Llama-3 70B,"The score is 1.00 because all the irrelevant nodes, such as node 2, which talks about a different section, node 3, which discusses Technical Data Disposal, and nodes 4-10, which are about unrelated topics like Government Property Management, are ranked lower than the relevant node 1, which directly answers the question about DND",
Contextual Precision,0.1,Llama-3 70B,"The score is 0.10 because all irrelevant nodes in the retrieval context, such as nodes ranked 1 to 9, do not provide any information about the training at DND facilities, and are ranked higher than the relevant node ranked 10, which states that ",
Contextual Precision,1.0,Llama-3 70B,"The score is 1.00 because all relevant nodes in the retrieval context, ranked 1 and 2, have ",
Contextual Precision,1.0,Llama-3 70B,"The score is 1.00 because all retrieval contexts are ranked correctly, with all ",
Contextual Precision,0.0,Llama-3 70B,"The score is 0.00 because there are no relevant nodes in the retrieval context, and hence, there is no opportunity for the model to rank relevant nodes higher than irrelevant nodes. The only node in the retrieval context at rank 1 is irrelevant, which does not allow the model to demonstrate its ranking capabilities. Therefore, the score is 0.00, indicating that the model failed to rank relevant nodes higher than irrelevant nodes in this context.",
Contextual Precision,0.05,Llama-3 70B,"The score is 0.05 because the top-ranked nodes in the retrieval context are mostly irrelevant to the input, with the first 20 nodes being ",
Contextual Precision,1.0,Llama-3 70B,"The score is 1.00 because all the irrelevant nodes in the retrieval context, like the second node ranked 2, and the third node ranked 3, are correctly ranked lower than the first relevant node, which is ranked 1, as they do not directly relate to the required validation in the accepted TDMP, as stated in the reasons ",
Contextual Precision,1.0,Llama-3 70B,"The score is 1.00 because all irrelevant nodes, starting from node 2, are correctly ranked lower than the first node, which directly addresses the question about TDMIS for the management of all Technical Data, providing a clear and concise answer. This perfect ranking showcases the model",
Contextual Precision,1.0,Llama-3 70B,"The score is 1.00 because all irrelevant nodes in the retrieval context, starting from rank 2, are correctly ranked lower than the relevant node at rank 1, which directly answers the question asked, making the model perfectly precise in its ranking of relevant and irrelevant nodes in the retrieval context. This is fantastic and shows the model",
Contextual Precision,0.07692307692307693,Llama-3 70B,"The score is 0.08 because the irrelevant nodes, like node 1, node 2, node 3, node 4, node 5, node 6, node 7, node 8, node 9, node 10, node 11, node 12, node 13, node 14, and node 15, are ranked higher than the relevant node, node 16, which is only at rank 16, showing that the model is not effectively prioritizing relevant information over irrelevant information. The relevant node at rank 16 states, ",
Contextual Precision,1.0,Llama-3 70B,"The score is 1.00 because all the irrelevant nodes in the retrieval context, ranked 3-12, have reasons that clearly state they are not relevant to the topic of editing an entry in ios, and are thus correctly ranked lower than the relevant nodes, ranked 1-2, which provide clear and concise information about editing an entry in ios, such as ",
Contextual Precision,0.0,Llama-3 70B,"The score is 0.00 because all nodes in the retrieval context are irrelevant to the input, with the first node stating ",
