metric,score,evaluation_model,reason,error
Contextual Precision,1.0,Llama-3 70B,"The score is 1.00 because all the irrelevant nodes in the retrieval context, such as node 2 discussing telemetry, node 3 discussing star tracker, node 4 discussing recalibrating accelerometers, node 5 discussing functional requirements, node 6 discussing commissioning phase, node 7 discussing residual rates, node 8 discussing spacecraft axis, node 9 discussing components of resistance, node 10 discussing motorisation factor, and node 11 discussing dynamical analysis, are correctly ranked lower than the relevant node 1, which directly answers the input question about orthogonal axes and torques, providing a perfect ranking of relevant and irrelevant nodes.",
Contextual Precision,0.0,Llama-3 70B,"The score is 0.00 because the only node in the retrieval context is irrelevant to the input question and is ranked first, indicating that the model failed to prioritize relevant information over irrelevant information, which is a crucial aspect of contextual precision. The node at rank 1 is irrelevant because it provides unrelated dates such as October 1999 and November 1993, which do not match the launch date asked in the input question.",
Contextual Precision,0.625,Llama-3 70B,"The score is 0.62 because the model correctly ranked the first and eighth nodes as relevant, but incorrectly ranked the second to seventh nodes as irrelevant, even though they do not provide information about Earth swing-bys, which should be ranked lower. The eighth node is correctly ranked higher because it mentions ",
Contextual Precision,0.0,Llama-3 70B,"The score is 0.00 because all nodes in the retrieval context are irrelevant to the input, with the first 24 nodes being ranked higher than relevant nodes, which does not exist in this case. The nodes are ranked based on reasons such as ",
Contextual Precision,1.0,Llama-3 70B,"The score is 1.00 because all the irrelevant nodes, starting from the second node, are correctly ranked lower than the first node, which directly addresses the question asked, as stated in ",
Contextual Precision,0.8166666666666667,Llama-3 70B,"The score is 0.82 because most of the relevant nodes in the retrieval context, such as node 1 and node 2, are ranked higher than the irrelevant nodes, but nodes 3 and 7, which are not directly related to the subsystem",
Contextual Precision,1.0,Llama-3 70B,"The score is 1.00 because all the irrelevant nodes in the retrieval context, starting from rank 2, are correctly ranked lower than the relevant node at rank 1, which clearly states that the main actuator for orbit around the comet nucleus is reaction wheels. The model has successfully distinguished between relevant and irrelevant information, resulting in a perfect score.",
Contextual Precision,0.5588235294117647,Llama-3 70B,"The score is 0.56 because the model of the comet nucleus provided by ESOC FD is correctly ranked at the top, with the first node stating ",
Contextual Precision,1.0,Llama-3 70B,"The score is 1.00 because all the relevant nodes in the retrieval context, such as the first node, are correctly ranked higher than the irrelevant nodes, which are ranked lower, such as the second node with reason ",
Contextual Precision,1.0,Llama-3 70B,"The score is 1.00 because all relevant nodes in the retrieval context are ranked higher than the irrelevant nodes, with the first node being the most relevant, as it mentions ",
Contextual Precision,0.41666666666666663,Llama-3 70B,"The score is 0.42 because the first two nodes in the retrieval context, which are irrelevant to the topic of silicon solar cells or backshielding accuracy, are ranked higher than the relevant nodes, specifically the third and fourth nodes that directly address the question. The reasons provided for the irrelevant nodes, ",
