metric,score,evaluation_model,reason,error
Contextual Precision,0.20833333333333331,Llama-3 70B,"The score is 0.21 because the model failed to rank the relevant nodes higher than the irrelevant nodes, particularly the 5th node which is irrelevant, yet ranked higher than the 6th node which is relevant, and the 8th node which is also relevant, but ranked lower than the 7th node which is irrelevant, indicating that the model is not effectively distinguishing between relevant and irrelevant nodes in the retrieval context. The model should prioritize nodes with reasons like ",
Contextual Precision,1.0,Llama-3 70B,"The score is 1.00 because all nodes in the retrieval context that are relevant to the input are ranked higher than irrelevant nodes. For example, the first node is ranked 1 and directly answers the question of what the approval date will be, whereas the second node is ranked 2 and doesn",
Contextual Precision,1.0,Llama-3 70B,"The score is 1.00 because the relevant node at rank 1 is correctly ranked higher than all the irrelevant nodes at ranks 2-7, which have reasons such as ",
Contextual Precision,1.0,Llama-3 70B,"The score is 1.00 because the only relevant node is ranked first, which perfectly matches the input query. The irrelevant nodes are correctly ranked lower, starting from rank 2, as they do not provide any relevant information about why an authority might request new evidence for some safety criteria at some moment, after having agreed previously upon how to show compliance with such criteria, in the given text.",
Contextual Precision,1.0,Llama-3 70B,"The score is 1.00 because all the irrelevant nodes in the retrieval context, such as node 2 mentioning ",
Contextual Precision,0.827437641723356,Llama-3 70B,"The score is 0.83 because the model correctly ranks most relevant nodes higher than irrelevant ones, such as the first and second nodes which are directly addressing the question, but fails to do so for the third and sixth nodes which are not directly related to evidence management, resulting in a slightly lower score.",
Contextual Precision,0.5,Llama-3 70B,"The score is 0.50 because only half of the top-ranked nodes in the retrieval context are relevant to the input, with the second-ranked node being the only relevant one among the top two, and the irrelevant nodes, such as the first node, which is just a table of contents for the appendixes, and the third node, which is just a title for the tools for evidence management, being ranked higher than some relevant nodes. However, the second-ranked node provides the steps involved in the approach, which is exactly what the input is asking for, hence the score is not lower. The irrelevant nodes from rank 4 onwards do not affect the score much as they are already ranked lower than the relevant node at rank 2.",
Contextual Precision,1.0,Llama-3 70B,"The score is 1.00 because all the relevant nodes in the retrieval context are ranked higher than the irrelevant nodes, with the first node providing a clear connection between the context and the expected output, and the rest of the nodes being correctly identified as not providing any information about the 6 steps or requirements elicitation and requirements specification, thus resulting in a perfect ranking order.",
Contextual Precision,1.0,Llama-3 70B,"The score is 1.00 because all the relevant nodes, like node 1 and node 2, are ranked higher than the irrelevant nodes, which start from node 3. The irrelevant nodes, such as ",
Contextual Precision,1.0,Llama-3 70B,"The score is 1.00 because all relevant nodes are ranked higher than irrelevant nodes. The first node in the retrieval context is directly related to the input and provides the required information, which is why it",
Contextual Precision,1.0,Llama-3 70B,"The score is 1.00 because all the relevant nodes in the retrieval context are correctly ranked higher than the irrelevant nodes, with the first node directly addressing the question and the rest of the nodes being correctly identified as unrelated to the aim of the survey, thus achieving perfect contextual precision.",
Contextual Precision,1.0,Llama-3 70B,"The score is 1.00 because all the irrelevant nodes in the retrieval context, starting from the second node, do not provide any information about the component level requirements, and are correctly ranked lower than the first node which is relevant to the input and provides detailed information about the component level requirements, thus achieving a perfect contextual precision score of 1.00",
Contextual Precision,1.0,Llama-3 70B,"The score is 1.00 because all the irrelevant nodes in the retrieval context, such as nodes ranked 2-10, do not mention anything about the question, and the relevant node at rank 1 explicitly defines a business process, resulting in perfect ranking of relevant nodes higher than irrelevant nodes.",
Contextual Precision,1.0,Llama-3 70B,"The score is 1.00 because all relevant nodes in the retrieval context are ranked higher than the irrelevant nodes. The first five nodes in the retrieval context, ranked 1 to 5, all have ",
Contextual Precision,0.25,Llama-3 70B,"The score is 0.25 because the relevant node at rank 4 is ranked higher than only 3 out of 8 irrelevant nodes. The irrelevant nodes at ranks 1, 2, and 3 should be ranked lower because they do not provide the required information and do not directly address the aim of the business process-based RE approach. The relevant node at rank 4 correctly addresses the question by stating that ",
Contextual Precision,1.0,Llama-3 70B,"The score is 1.00 because all the irrelevant nodes in the retrieval context, such as nodes 2-10, are correctly ranked lower than the relevant node at rank 1, which directly addresses the expected output about the Lunar Exploration Light Rover taking imagery of itself and the surrounding terrain upon command, as stated in its",
Contextual Precision,0.3333333333333333,Llama-3 70B,"The score is 0.33 because the first two nodes in the retrieval context are irrelevant, as they do not address the specific question of what the Lunar Exploration Light Rover should have in the High Manoeuvrability Options. The third node is relevant, but then the ranking drops again with the next five nodes being irrelevant, which should be ranked lower. The relevant node should be ranked higher, which is why the score is not higher.",
Contextual Precision,1.0,Llama-3 70B,"The score is 1.00 because all the irrelevant nodes, such as the 2nd node with reason ",
Contextual Precision,0.0,Llama-3 70B,"The score is 0.00 because there are no retrieval contexts to evaluate, so there is no ranking to consider for irrelevant nodes in the retrieval context. Therefore, the score is 0.00",
Contextual Precision,1.0,Llama-3 70B,"The score is 1.00 because all the irrelevant nodes in the retrieval context are correctly ranked lower than the first node, which directly answers the question asked, stating that ",
Contextual Precision,0.14285714285714285,Llama-3 70B,"The score is 0.14 because the first 6 nodes in the retrieval context, which are irrelevant to the input, are ranked higher than the relevant node at rank 7, which specifically states the rollover threshold of the Lunar Exploration Light Rover. This suggests that the model is not effectively distinguishing between relevant and irrelevant nodes, leading to a low contextual precision score.",
Contextual Precision,1.0,Llama-3 70B,"The score is 1.00 because the only relevant node in the retrieval context, which is the first node, directly answers the question about the capable speed the Lunar Exploration Light Rover can maintain, and all the other nodes are irrelevant to the question, which are correctly ranked lower than the relevant node. This perfect ranking is what gives the score a perfect score of 1.00. It",
Contextual Precision,0.0,Llama-3 70B,"The score is 0.00 because all the nodes in the retrieval context, including the first node, second node, and so on, are irrelevant to the input question and are ranked higher than relevant nodes, which should be ranked higher according to their relevance to the input question. The reasons provided for these nodes, such as ",
Contextual Precision,1.0,Llama-3 70B,"The score is 1.00 because the only relevant node at rank 1 is correctly ranked higher than all the irrelevant nodes, which are all ranked lower from 2 to 20, as they do not provide any information about the Lunar Exploration Light Rover",
Contextual Precision,0.05263157894736842,Llama-3 70B,"The score is 0.05 because all the irrelevant nodes, such as the 1st node talking about different types of testing, the 5th node discussing a project and its documentation, and many nodes discussing SWRE requirements, are ranked higher than the only relevant node, which is the 21st node explaining how system level testing should be performed using on-board procedures written in SCL and executed on-board, any deviation from this shall be agreed with ESA in advance. This indicates that the model is not effectively distinguishing between relevant and irrelevant nodes, resulting in a low contextual precision score.",
Contextual Precision,0.16666666666666666,Llama-3 70B,"The score is 0.17 because the irrelevant nodes, like node 1, 2, 3, 4, and 5, are ranked higher than the relevant node 6, which correctly defines relative pointing error. The irrelevant nodes should be ranked lower than the relevant node to improve the score.",
Contextual Precision,1.0,Llama-3 70B,"The score is 1.00 because all relevant nodes in the retrieval context, such as node 1 and node 2, are correctly ranked higher than irrelevant nodes, like nodes 3-10, due to the clear explanations provided in their reasons, like ",
Contextual Precision,1.0,Llama-3 70B,"The score is 1.00 because all the irrelevant nodes in the retrieval context are correctly ranked lower than the relevant node, which is ranked 1st. The relevant node directly addresses the question with the expected output, providing the required information about the control accuracy of each of the solar array orientations. The rest of the nodes do not provide any relevant information and are correctly ranked lower, starting from the 2nd node onwards, which talks about high gain antenna pointing and so on, and are not related to the question being asked.",
Contextual Precision,0.3333333333333333,Llama-3 70B,"The score is 0.33 because only 1 out of 3 top-ranked nodes in the retrieval context are relevant to the input, with the 1st and 2nd nodes being irrelevant nodes, as they are about ",
Contextual Precision,1.0,Llama-3 70B,"The score is 1.00 because all irrelevant nodes in the retrieval context, such as nodes ranked 2-15, do not provide any relevant information to the question being asked, and are correctly ranked lower than the relevant node ranked 1, which explicitly states the required information, thus demonstrating perfect contextual precision.",
Contextual Precision,1.0,Llama-3 70B,"The score is 1.00 because all the irrelevant nodes in the retrieval context, such as the nodes ranked 2 to 20, do not address the wake-up functionality or the re-pointing of the HGA assembly to the Earth in any way, and are correctly ranked lower than the relevant node ranked 1, which explicitly states the required information, resulting in a perfect ranking of relevant nodes above irrelevant nodes, hence a score of 1.00",
Contextual Precision,0.5,Llama-3 70B,"The score is 0.50 because the relevant node at rank 2 is correctly ranked higher than the irrelevant nodes at ranks 1 and 3, but the irrelevant node at rank 4 should be ranked lower than the relevant node at rank 2, as the passage at rank 4 does not mention the launch date of the Rosetta Mission, unlike the passage at rank 2 which explicitly states it as ",
Contextual Precision,1.0,Llama-3 70B,"The score is 1.00 because the only node in the retrieval context is relevant to the input, and thus it is ranked correctly at the top position, which is 1.",
Contextual Precision,1.0,Llama-3 70B,"The score is 1.00 because all the irrelevant nodes, from rank 2 to 20, are correctly ranked lower than the relevant node at rank 1, which explicitly states the benefits of separating functions, including ",
Contextual Precision,0.3333333333333333,Llama-3 70B,"The score is 0.33 because the first and second nodes in the retrieval context are irrelevant to the input, and are ranked higher than the third node which is relevant. The third node should be ranked higher as it directly answers the question about the Rosetta mission",
Contextual Precision,0.5,Llama-3 70B,"The score is 0.50 because the irrelevant node at rank 1 should be ranked lower than the relevant node at rank 2, as the latter clearly mentions the asteroids in the mission phase, while the former does not mention the spacecraft",
Contextual Precision,1.0,Llama-3 70B,"The score is 1.00 because all irrelevant nodes in the retrieval context are correctly ranked lower than the first node, which directly defines Yield Loads as ",
Contextual Precision,0.6666666666666666,Llama-3 70B,"The score is 0.67 because the top-ranked nodes in the retrieval context, such as node 1, correctly address the question of static analysis of software code, but nodes 2, 3, 4, 5, 7, 8, and 9, which are irrelevant to the input, are ranked relatively high, which reduces the precision score. The ",
Contextual Precision,1.0,Llama-3 70B,"The score is 1.00 because all irrelevant nodes, from rank 2 to 20, have ",
Contextual Precision,0.3333333333333333,Llama-3 70B,"The score is 0.33 because only 1 out of the top 3 nodes in the retrieval context directly addresses the question, while the other 2 nodes at ranks 1 and 2 are irrelevant nodes, with reasons such as ",
Contextual Precision,1.0,Llama-3 70B,"The score is 1.00 because all the irrelevant nodes (rank 3-6) are correctly ranked lower than the relevant nodes (rank 1-2) as they are unrelated to the topic of pointing error during asteroid fly-by phase, and the relevant nodes have quotes that directly address the expected output, even if they are for different phases or have different error values.",
Contextual Precision,0.14285714285714285,Llama-3 70B,"The score is 0.14 because the relevant node at rank 7 is ranked lower than the 6 irrelevant nodes, with reasons like ",
Contextual Precision,1.0,Llama-3 70B,"The score is 1.00 because all relevant nodes in the retrieval context, such as nodes 1, 2, and 3, are correctly ranked higher than the irrelevant nodes, which do not mention Major orbit manoeuvres in their reasons, thus perfectly separating relevant and irrelevant information, achieving a perfect contextual precision score of 1.00",
Contextual Precision,1.0,Llama-3 70B,"The score is 1.00 because all the irrelevant nodes in the retrieval context, such as the 2nd, 3rd, 4th, 5th, 6th, 7th, 8th and 9th nodes, are correctly ranked lower than the first node, which is directly relevant to the input question about the confidence level during the comet nucleus observation phase, as stated in its reason ",
Contextual Precision,0.0,Llama-3 70B,"The score is 0.00 because all the nodes in the retrieval context are irrelevant to the input, with the top-ranked nodes (nodes 1-20) being unrelated lists of abbreviations and definitions, failing to address the Propulsion System or condensation of propellants outside the reach of the propellant management device (PMD) within the tanks, resulting in a complete mismatch between the input and the ranked nodes. The lack of relevant nodes in the top rankings is the primary reason for the low score.",
Contextual Precision,1.0,Llama-3 70B,The score is 1.00 because the relevant node at rank 1 clearly provides information about Rosetta,
Contextual Precision,1.0,Llama-3 70B,"The score is 1.00 because all irrelevant nodes in the retrieval context, starting from rank 2, are correctly ranked lower than the highly relevant first node, which clearly addresses the question with a direct answer. This perfect ranking is a testament to the model",
Contextual Precision,0.0,Llama-3 70B,"The score is 0.00 because all 20 nodes in the retrieval context are irrelevant to the input, with the top-ranked node being the first node, which does not mention the specific requirement of conducting an annual trend analysis, starting at the date of contract award, of the sum of quantified benefits of all proposed and implemented changes from continuous improvements and value engineering, but rather general safety and environmental program management, governance, and other unrelated topics. Therefore, the irrelevant nodes are ranked higher than the non-existent relevant nodes, resulting in a score of 0.00",
Contextual Precision,0.22619047619047616,Llama-3 70B,"The score is 0.23 because the first 5 nodes in the retrieval context, which are irrelevant to the input, are ranked higher than the relevant nodes, specifically the 6th and 7th nodes, which directly relate to counting items or calculating percentages. For example, the 1st node is ranked higher despite being about risk management, and the 6th node, which is directly related to the expected output, is ranked lower. This shows that the model is not effectively distinguishing between relevant and irrelevant nodes, resulting in a low contextual precision score.",
Contextual Precision,0.0,Llama-3 70B,"The score is 0.00 because all nodes in the retrieval context are irrelevant to the input, with the first node mentioning locations of Group installation, the second node discussing maintenance responsibilities, the third node talking about contracts for Halifax-class ships, and the fourth node being a list of abbreviations, acronyms, and definitions, none of which are related to the Maintenance activities assigned to RCN units defined in the input. As a result, the irrelevant nodes are ranked higher than the relevant nodes, which doesn",
Contextual Precision,0.0,Llama-3 70B,"The score is 0.00 because there are no retrieval contexts to evaluate, hence no nodes are ranked correctly or incorrectly, resulting in a score of 0.00",
Contextual Precision,0.0,Llama-3 70B,"The score is 0.00 because all nodes in the retrieval context are irrelevant to the input, with the top-ranked node being irrelevant, as stated in its reason: ",
Contextual Precision,1.0,Llama-3 70B,"The score is 1.00 because the only relevant node at rank 1 perfectly answers the input question, and all the irrelevant nodes are correctly ranked lower. This model has successfully distinguished between relevant and irrelevant nodes in the retrieval context, achieving a perfect contextual precision score.",
Contextual Precision,0.0,Llama-3 70B,"The score is 0.00 because all the top ranked nodes in the retrieval context are irrelevant to the input, with reasons such as ",
Contextual Precision,1.0,Llama-3 70B,"The score is 1.00 because all irrelevant nodes in the retrieval context, such as nodes 2-15, which provide no relevant information regarding the question, are correctly ranked lower than the first node which directly addresses the question, thus achieving perfect contextual precision.",
Contextual Precision,1.0,Llama-3 70B,"The score is 1.00 because all irrelevant nodes in the retrieval context, such as node 2, which does not mention disposal management meeting any specific regulations or requirements in this context, node 3, which is about validation as required in the accepted TDMP, and so on, are correctly ranked lower than the relevant node 1, which clearly addresses the question by stating that ",
Contextual Precision,1.0,Llama-3 70B,The score is 1.00 because all the relevant nodes are ranked higher than the irrelevant nodes in the retrieval contexts. The first node is directly related to the contractor,
Contextual Precision,0.0,Llama-3 70B,"The score is 0.00 because all nodes in the retrieval context are ranked as irrelevant, with the first 20 nodes having reasons such as ",
Contextual Precision,0.0,Llama-3 70B,"The score is 0.00 because all the nodes in the retrieval context are irrelevant to the input, with the top-ranked node at rank 1 stating ",
Contextual Precision,0.0,Llama-3 70B,"The score is 0.00 because all nodes in the retrieval context are irrelevant to the input, with the first node mentioning ",
Contextual Precision,0.0,Llama-3 70B,"The score is 0.00 because there are no retrieval contexts provided, hence no relevant nodes are ranked higher than irrelevant nodes in the retrieval contexts, resulting in a precision score of 0.00",
Contextual Precision,0.31484395234395235,Llama-3 70B,"The score is 0.31 because the irrelevant nodes, ranked 1-6, are not correctly prioritized, with reasons such as ",
Contextual Precision,1.0,Llama-3 70B,"The score is 1.00 because all the irrelevant nodes in the retrieval context are correctly ranked lower than the relevant node at rank 1, which perfectly matches the input, demonstrating a flawless contextual precision score. The irrelevant nodes at ranks 2-9 are correctly distinguished from the relevant node due to their reasons not being related to adopting and amending security arrangements, partnerships and alliances, resulting in a perfect ranking and a score of 1.00.",
Contextual Precision,1.0,Llama-3 70B,"The score is 1.00 because all the irrelevant nodes in the retrieval context are correctly ranked lower than the relevant node at rank 1, which provides a direct answer to the question, stating that ",
Contextual Precision,0.0,Llama-3 70B,"The score is 0.00 because all the nodes in the retrieval context are irrelevant to the input, as they all lack direct mention of ",
Contextual Precision,0.0,Llama-3 70B,"The score is 0.00 because there are no retrieval contexts provided, so it",
Contextual Precision,0.0,Llama-3 70B,"The score is 0.00 because all the nodes in the retrieval context are ranked as irrelevant, with reasons such as ",
Contextual Precision,0.7928571428571428,Llama-3 70B,"The score is 0.79 because the top 4 nodes in the retrieval context are all relevant, with reasons that explicitly mention collaboration and governance, which aligns with the input. However, nodes 5-10 are irrelevant, with reasons that discuss general information, roles, and responsibilities, which are not directly related to the expected output. Node 11 is relevant again, but nodes 12-15 are irrelevant, which affects the overall ranking and brings the score down to 0.79. The irrelevant nodes should be ranked lower to improve the score.",
Contextual Precision,1.0,Llama-3 70B,"The score is 1.00 because all irrelevant nodes are correctly ranked lower than the single relevant node at rank 1, which explicitly answers the input question about the purpose of Performance Assessment, as stated in its",
Contextual Precision,0.0,Llama-3 70B,"The score is 0.00 because all nodes in the retrieval context are irrelevant to the input, with none of them providing information about adding a new entry on the database by clicking add entry on the main menu, as stated in the reasons for nodes ranked 1 through 20. Therefore, none of the nodes are ranked higher than the irrelevant nodes, resulting in a score of 0.00",
Contextual Precision,1.0,Llama-3 70B,"The score is 1.00 because all the relevant nodes in the retrieval context, ranked 1 and 2, directly answer the question, while all the irrelevant nodes are ranked lower, starting from 3, which correctly prioritizes the relevant information, resulting in a perfect contextual precision score. The top-ranked nodes provide a clear explanation of why the Lunar Exploration Light Rover imaging should cover 360° in azimuth around the rover, making the model",
Contextual Precision,0.0,Llama-3 70B,"The score is 0.00 because all the nodes in the retrieval context are irrelevant to the input, with the first node being about maintenance and field operations of a Lunar Exploration Light Rover, the second node being about evidence management, and all the subsequent nodes being about a project FP7, none of which are related to the capabilities in a prototype. As a result, the model fails to rank any relevant nodes higher than the irrelevant ones, leading to a precision score of 0.00",
Contextual Precision,1.0,Llama-3 70B,"The score is 1.00 because all the irrelevant nodes in the retrieval contexts are correctly ranked lower than the relevant node at rank 1, which directly addresses the expected output by mentioning the specific features that the Lunar Exploration Light Rover shall provide for crew navigation when upgraded to transport astronaut. The irrelevant nodes at ranks 2-20 provide information about workstation for driving and navigation, camera display, standard interface, payload control, remote control, remote commanding, remote control station usability, remote operator displays, multiple command sources, equipment durability, dust kick-up, shock exposure, and sensor payload accommodation, which are not relevant to the expected output about crew navigation. The model has perfectly distinguished between relevant and irrelevant nodes, resulting in a perfect contextual precision score of 1.00.",
Contextual Precision,0.8055555555555555,Llama-3 70B,"The score is 0.81 because the model successfully ranks the first, third, and fourth nodes in the retrieval context higher than the irrelevant nodes, as the first node directly states the core idea of Tele-Operation mode, the third node explains the role of specific centers in this mode, and the fourth node describes the priority of command sources. However, the model ranks the second and fifth nodes higher than they should be, as the second node is only about update rates and the fifth node is just a number, which are not directly related to what happens in Tele-Operation mode.",
Contextual Precision,0.25,Llama-3 70B,"The score is 0.25 because the first three nodes in the retrieval context are irrelevant, with reasons like ",
