metric,score,evaluation_model,reason,error
Correctness (GEval),1.0,Llama-3 70B,"The actual output matches the expected output with the same information and details, answering the input correctly",
Correctness (GEval),0.8,Llama-3 70B,"The actual output answers the input, but provides extra information and presents details in a different order than the expected output, with slight discrepancies in wording and phrasing",
Correctness (GEval),1.0,Llama-3 70B,The actual output accurately answers the input and matches the expected output with the correct label ,
