metric,score,evaluation_model,reason,error
Contextual Precision,1.0,Llama-3 70B,"The score is 1.00 because the only node in the retrieval context is directly relevant to the input, providing a clear and concise answer to the question asked, making it perfectly ranked.",
Contextual Precision,1.0,Llama-3 70B,"The score is 1.00 because the relevant node at rank 1 is correctly ranked higher than the irrelevant node at rank 2, which has a reason that is completely unrelated to the topic of the input question, ensuring perfect ranking of relevant nodes over irrelevant nodes in the retrieval context. This perfect ranking results in a score of 1.00, indicating excellent contextual precision performance.",
Contextual Precision,1.0,Llama-3 70B,"The score is 1.00 because the only node in the retrieval context is a perfect match, providing a clear and direct answer to the input question, with the reason ",
Contextual Precision,1.0,Llama-3 70B,"The score is 1.00 because all nodes in the retrieval context are relevant and ranked correctly, with the first node providing the exact speed and the second node reiterating the maximum speed requirement, ensuring a perfect ranking of relevant nodes over irrelevant nodes, which are none in this case.",
Contextual Precision,1.0,Llama-3 70B,"The score is 1.00 because all the nodes in the retrieval context are ranked correctly, with the top-ranked nodes providing clear and concise reasons why the Site Operations Center is for setup, checkout, driving to the test location and problem solving, and aligning with the expected output, making all irrelevant nodes absent from the retrieval context.",
Contextual Precision,1.0,Llama-3 70B,"The score is 1.00 because all irrelevant nodes, such as node 2, node 3, and node 4, are correctly ranked lower than the relevant node 1, which directly answers the question about the location determination accuracy of the Lunar Exploration Light Rover.",
Contextual Precision,1.0,Llama-3 70B,"The score is 1.00 because all the nodes in the retrieval context are relevant to the input and ranked accordingly, with the most relevant node ranked first, and the second most relevant node ranked second, resulting in perfect contextual precision score. The first node directly answers the question, and the second node provides closely related information, making both nodes highly relevant and correctly ranked.",
Contextual Precision,0.0,Llama-3 70B,"The score is 0.00 because there are no retrieval contexts provided, hence there are no nodes to rank and determine the contextual precision score from. Therefore, the score is 0.00, indicating the absence of relevant information in the retrieval contexts for the given input.",
Contextual Precision,0.0,Llama-3 70B,"The score is 0.00 because there are no retrieval contexts provided, so it is impossible to determine the ranking of relevant and irrelevant nodes in the retrieval context, hence the score is 0.00.  The contextual precision score is a measure of how well the relevant nodes are ranked above the irrelevant nodes, which cannot be calculated without any retrieval contexts.  Therefore, the score is 0.00, indicating that the ranking is not meaningful in this case.  It is expected that the score would increase with the presence of retrieval contexts that can be ranked accordingly.",
Contextual Precision,1.0,Llama-3 70B,"The score is 1.00 because all nodes in the retrieval context are perfectly ranked, with the first node being the most relevant as it provides the exact answer to the question, while the second node is correctly ranked lower due to lacking crucial information needed to answer the question, resulting in a perfect ranking order.",
Contextual Precision,0.0,Llama-3 70B,"The score is 0.00 because all nodes in the retrieval context are irrelevant to the input, with the first node not addressing the question of when the spacecraft design will not ensure communications with the Earth, and the second node discussing initial communications and fly-by but not providing information about the conjunction that affects spacecraft communications with Earth, resulting in all irrelevant nodes being ranked higher than relevant nodes, which is not ideal for a good contextual precision score.",
Contextual Precision,1.0,Llama-3 70B,"The score is 1.00 because all nodes in the retrieval context are perfectly ranked, with the most relevant node at rank 1, stating that ",
Contextual Precision,1.0,Llama-3 70B,"The score is 1.00 because all irrelevant nodes are correctly ranked lower than the first node which directly addresses the question, providing the specific reason for providing adequate failure tolerance and protection circuitry in the subsystem. The subsequent nodes do not provide this specific reason, hence are correctly ranked lower. This perfect ranking results in a score of 1.00, indicating excellent contextual precision.",
Contextual Precision,1.0,Llama-3 70B,"The score is 1.00 because all relevant nodes in the retrieval context, like the first node, are ranked higher than irrelevant nodes, which have lower ranks, like the second and third nodes, due to their reasons being not directly related to the input question, such as ",
Contextual Precision,1.0,Llama-3 70B,"The score is 1.00 because all nodes in the retrieval context are relevant to the input, with each node providing a clear and direct answer to the question about what the spacecraft will pass close to on its journey to the comet, such as Asteroid Otawara and Siwa, and are ranked correctly from the start.",
Contextual Precision,1.0,Llama-3 70B,"The score is 1.00 because all the nodes in the retrieval context are perfectly ranked, with the most relevant node at rank 1, which directly answers the input question, and the irrelevant node at rank 2, which does not provide any information about what the navigation authorities shall provide.",
Contextual Precision,1.0,Llama-3 70B,"The score is 1.00 because all nodes in the retrieval context are relevant to the input and are correctly ranked, with the first node directly stating the tool",
Contextual Precision,1.0,Llama-3 70B,"The score is 1.00 because all nodes in the retrieval context are relevant and correctly ranked, with the first node explicitly distinguishing between interplanetary cruise phase and near comet phase, the second node implying distinctions between mission phases, and the third node mentioning specific requirements for orbit manoeuvres in different mission phases, resulting in a perfect ranking of relevant nodes above irrelevant nodes, which are none in this case.",
Contextual Precision,1.0,Llama-3 70B,"The score is 1.00 because the only node in the retrieval context is a highly relevant node that directly answers the input question, making it a perfect ranking.",
Contextual Precision,1.0,Llama-3 70B,"The score is 1.00 because all the nodes in the retrieval context are relevant to the input and are ranked correctly, with the first node stating ",
Contextual Precision,1.0,Llama-3 70B,"The score is 1.00 because all the nodes in the retrieval context are correctly ranked with the relevant node at rank 1, as it clearly states that all the standard potted inserts shall be proof-tested up to 110% of their allowable loads before delivery of the assembly, which perfectly matches the input query.",
Contextual Precision,0.9166666666666666,Llama-3 70B,"The score is 0.92 because the top 3 ranked nodes in the retrieval context are all relevant to the input, with the first node providing a direct quote, the second node explaining the inadequacy of a chain of evidence, and the third node being an irrelevant node that should be ranked lower. However, it",
Contextual Precision,0.0,Llama-3 70B,"The score is 0.00 because all nodes in the retrieval context are irrelevant to the input, with the first node stating that the text does not provide any information about evidence traceability or evidence change impact analysis, the second node also stating the same, and the third node providing information about Design Loads, but not about evidence traceability or evidence change impact analysis, which are the main aspects to be studied during the design task. Therefore, none of the nodes are ranked higher than the irrelevant nodes, resulting in a score of 0.00.",
Contextual Precision,1.0,Llama-3 70B,"The score is 1.00 because all the nodes in the retrieval context are relevant to the input, and are ranked correctly with the most relevant nodes at the top. For instance, the first node mentions the design requirements for evidence management of the OPENCOSS platform, which is directly related to the design of the evidence management service infrastructure, and the second node explicitly states that the results will serve as basis for the next WP6 task, which is T6.2 - Design of the evidence management service infrastructure, and the third node clearly mentions that these requirements will be the basis for the design of the evidence management service infrastructure in T6.2. There are no irrelevant nodes in the retrieval context, hence the score is perfect.",
Contextual Precision,0.0,Llama-3 70B,"The score is 0.00 because the top-ranked nodes in the retrieval context are irrelevant to the input, specifically nodes ranked 1 and 2, which discuss a model-driven software process and artefacts not needing to be created always, but fail to address activities not explicitly addressed in the RE process, resulting in a complete mismatch between the input and the retrieval context.",
Contextual Precision,1.0,Llama-3 70B,"The score is 1.00 because the retrieval context is perfectly ranked, with the only relevant node at rank 1, providing a clear explanation for the overall approach involving four steps in WP6, as quoted in the node",
Contextual Precision,1.0,Llama-3 70B,"The score is 1.00 because all the nodes in the retrieval context are correctly ranked, with the first node explicitly stating the responsible party, making it a perfect ranking.",
Contextual Precision,1.0,Llama-3 70B,"The score is 1.00 because all nodes in the retrieval context are relevant to the input, with the first node explicitly stating the possibility of assigning requirements to system components and the second node providing further evidence of separate teams implementing the same system with the same functionality, thus ranking all relevant nodes at the top.",
Contextual Precision,0.5,Llama-3 70B,"The score is 0.50 because the irrelevant nodes, such as the 1st node that explains the aim of the RE approach in general terms and the 3rd node that defines what a business process is, are ranked equally with the relevant nodes, like the 2nd node that mentions the lack of knowledge about the application by system analysts, which is a key aspect of understanding the application domain. The irrelevant nodes should be ranked lower to increase the contextual precision score.",
Contextual Precision,1.0,Llama-3 70B,"The score is 1.00 because all the relevant nodes in the retrieval context are ranked higher than the irrelevant nodes, with the top 2 nodes providing direct answers to the input question and the third node being correctly placed at the bottom due to its indirect relevance to the main functional areas of the OPENCOSS platform, as explained in its reason ",
Contextual Precision,0.0,Llama-3 70B,"The score is 0.00 because all nodes in the retrieval context are irrelevant to the input, with the first node being irrelevant due to not mentioning system analysts, application knowledge, or organization needs, the second node providing background information, and the third node discussing high-level requirements and modifications, making all nodes in the retrieval context ranked equally low and irrelevant to the main problem in the design of the approach.",
Contextual Precision,1.0,Llama-3 70B,"The score is 1.00 because the only node in the retrieval context directly answers the question and is ranked first, making it a perfect ranking of relevant nodes over irrelevant nodes, which are none in this case.",
Contextual Precision,0.0,Llama-3 70B,"The score is 0.00 because all the nodes in the retrieval context are irrelevant to the input, specifically the first node, which talks about absolute localization, and is ranked as the highest node, whereas it should be ranked lower than relevant nodes, which are not present in this case, resulting in a score of 0.00",
Contextual Precision,0.8333333333333333,Llama-3 70B,"The score is 0.83 because the top two nodes in the retrieval context are relevant, but the third node, which is ranked third, should be ranked higher than the second node, which is irrelevant, as it provides additional context about ",
Contextual Precision,1.0,Llama-3 70B,"The score is 1.00 because the only node in the retrieval context, ranked 1, directly answers the question with the correct information, making it a perfect ranking of relevant nodes above irrelevant nodes, which in this case, there are none.",
Contextual Precision,1.0,Llama-3 70B,"The score is 1.00 because all retrieval contexts, specifically the first node, directly mention the expected output ",
Contextual Precision,1.0,Llama-3 70B,"The score is 1.00 because all the nodes in the retrieval context are relevant to the input, and the relevant nodes are ranked higher than irrelevant nodes, which is perfect ranking. The first node in the retrieval context is directly defining the absolute pointing error, which is exactly what the input is asking for, hence the perfect score.",
Contextual Precision,1.0,Llama-3 70B,"The score is 1.00 because all nodes in the retrieval context are relevant and correctly ranked at the top, with the first node providing a direct definition of relative pointing error and the second node providing relevant context to the topic.",
Contextual Precision,1.0,Llama-3 70B,"The score is 1.00 because the only node in the retrieval context is directly relevant to the input, with a clear and concise definition of the absolute measurement error provided in the node",
Contextual Precision,1.0,Llama-3 70B,"The score is 1.00 because all nodes in the retrieval context are relevant to the input, and are ranked accordingly, with the first node and second node both providing direct answers to the question.",
Contextual Precision,1.0,Llama-3 70B,"The score is 1.00 because all the nodes in the retrieval context are correctly ranked, with the most relevant node at rank 1, and the less relevant nodes at lower ranks. The first node directly addresses the question, while the second and third nodes, though related, do not directly address the question of re-acquiring sun pointing after a specific manoeuvre, and thus are correctly ranked lower.",
Contextual Precision,1.0,Llama-3 70B,"The score is 1.00 because all nodes in the retrieval context are relevant to the input, with the first node directly answering the question with a clear explanation, making it a perfect ranking with all relevant nodes ranked higher than non-existent irrelevant nodes.",
Contextual Precision,1.0,Llama-3 70B,The score is 1.00 because all retrieval contexts have ,
Contextual Precision,1.0,Llama-3 70B,"The score is 1.00 because all the relevant nodes in the retrieval context are ranked higher than the irrelevant nodes. For instance, the first node is directly answering the question, and the second and third nodes are not relevant, hence ranked lower accordingly.",
Contextual Precision,1.0,Llama-3 70B,The score is 1.00 because all relevant nodes in the retrieval context are ranked higher than irrelevant nodes. The first node mentions ,
Contextual Precision,1.0,Llama-3 70B,"The score is 1.00 because all nodes in the retrieval context are ranked correctly, with the relevant node being ranked first with a clear and direct answer to the question, providing a perfect ranking order.",
Contextual Precision,1.0,Llama-3 70B,"The score is 1.00 because the only node in the retrieval context, ranked 1, directly answers the question, making it perfectly ranked and scored.",
Contextual Precision,1.0,Llama-3 70B,"The score is 1.00 because the retrieval context correctly ranked the relevant node, which explicitly answers the question, as the top node, and the irrelevant node, which does not provide any information about the number of asteroids the spacecraft will pass, as the second node, demonstrating perfect contextual precision ranking.",
Contextual Precision,0.5,Llama-3 70B,"The score is 0.50 because there is one irrelevant node at rank 1, which is not directly related to the question and talks about language features and operating system features, whereas the relevant node at rank 2 is directly related to the question and states that assembler code is generally prohibited unless necessary. This results in a score that is not higher, as the model does not prioritize the relevant node over the irrelevant one from the start.",
Contextual Precision,0.0,Llama-3 70B,"The score is 0.00 because there are no retrieval contexts to evaluate, so it",
Contextual Precision,0.3333333333333333,Llama-3 70B,"The score is 0.33 because the first two nodes in the retrieval context, ranked 1 and 2, are irrelevant nodes with reasons ",
Contextual Precision,1.0,Llama-3 70B,"The score is 1.00 because all nodes in the retrieval context are relevant and correctly ranked, with the first node explicitly mentioning ",
Contextual Precision,1.0,Llama-3 70B,"The score is 1.00 because all nodes in the retrieval context are perfectly ranked, with the most relevant node being ranked first, which directly answers the input question by stating the exact requirement of the Propulsion System to prevent condensation of propellants outside the reach of the PMD within the tanks, as quoted in the first node",
Contextual Precision,1.0,Llama-3 70B,"The score is 1.00 because all nodes in the retrieval context are relevant to the input, and are correctly ranked at the top with the first node being the most relevant one, which explicitly answers the question with ",
Contextual Precision,1.0,Llama-3 70B,"The score is 1.00 because all the relevant nodes in the retrieval context are ranked higher than the irrelevant nodes, with the most relevant node being the first node which directly answers the question, stating that the Contractor does not need to provide Engineering Change Proposals for proposed changes that do not change the form, fit and function of the HCCS EG, and the irrelevant node being ranked lower at rank 2 with the reason being that PWS-913 is not relevant to the question and does not provide any information about the topic. The ranking is perfect, hence the score is 1.00, which is ideal for contextual precision. This is a perfect ranking, and it",
Contextual Precision,1.0,Llama-3 70B,"The score is 1.00 because all nodes in the retrieval context are correctly ranked, with the first node explicitly stating the performance indicators the Contractor must quantify and the second node directly providing the expected output, resulting in a perfect ranking of relevant nodes over irrelevant nodes, which are nonexistent in this case.",
Contextual Precision,1.0,Llama-3 70B,"The score is 1.00 because all the relevant nodes in the retrieval context are ranked higher than the irrelevant nodes. Specifically, the first node clearly states how RCN Units can be assisted, and the second node provides additional information about the role of the Contractor. The third node, which is irrelevant, is correctly ranked lower than the first two nodes, resulting in a perfect score.",
Contextual Precision,1.0,Llama-3 70B,"The score is 1.00 because all the relevant nodes in the retrieval context, such as node 1, are ranked higher than the irrelevant nodes, which have reasons like ",
Contextual Precision,1.0,Llama-3 70B,"The score is 1.00 because all nodes in the retrieval context are ranked correctly, with the most relevant nodes at the top. The first node clearly states the requirement for obtaining and managing import and export licenses, and the second node further supports this requirement by mentioning related aspects like export license control and transportation arrangements. Therefore, all irrelevant nodes are correctly ranked lower, resulting in a perfect contextual precision score.",
Contextual Precision,1.0,Llama-3 70B,"The score is 1.00 because all nodes in the retrieval context are relevant to the input, with the first node and second node both providing clear context that the Contractor must provide engineering support of EC installations conducted by DND, thus ranking them correctly at the top.",
Contextual Precision,1.0,Llama-3 70B,"The score is 1.00 because all nodes in the retrieval context are relevant to the input, with the first node explicitly stating the required procedures to support EC installations, making it perfectly ranked.",
Contextual Precision,0.0,Llama-3 70B,"The score is 0.00 because there are no retrieval contexts provided to calculate the contextual precision score. Therefore, there is no ranking to evaluate, resulting in a score of 0.00. The score cannot be higher because there is no data to analyze, making it impossible to determine the relevance of nodes in the retrieval context to the input question.",
Contextual Precision,1.0,Llama-3 70B,"The score is 1.00 because all the relevant nodes in the retrieval context, such as node 1, are correctly ranked higher than the irrelevant nodes, as they provide direct answers to the input question, like ",
Contextual Precision,1.0,Llama-3 70B,"The score is 1.00 because all the relevant nodes in the retrieval context are ranked higher than the irrelevant nodes. In this case, the first node which clearly states what DND provides on the Contractor disposal management is ranked first, while the second node which only talks about the Contractor",
Contextual Precision,1.0,Llama-3 70B,"The score is 1.00 because all relevant nodes in the retrieval context are ranked higher than irrelevant nodes. The first node is directly addressing the question, whereas the second node, ranked 2, is discussing a different scope of work and does not answer the question, hence it is ranked lower accordingly.",
Contextual Precision,1.0,Llama-3 70B,"The score is 1.00 because all nodes in the retrieval context are relevant to the input and ranked correctly, as seen in the first node which explicitly defines Government Property with a clear and concise explanation, making it a perfect match for the input query.",
Contextual Precision,1.0,Llama-3 70B,"The score is 1.00 because all the nodes in the retrieval context are relevant to the input, with the first node stating that the HCCS EG will require ISS support until end of life for the Halifax-class, the second node mentioning that the contractor must support the HCCS EG under the Performance Management Framework, and the third node stating that the contractor must investigate and implement any changes required to the HCCS EG support system, all implying that it remains supportable throughout its service life. This perfect ranking demonstrates the model",
Contextual Precision,1.0,Llama-3 70B,"The score is 1.00 because all irrelevant nodes in the retrieval context are correctly ranked lower than relevant nodes, such as node 2 which is not directly related to establishing governance structure for security risk management, and thus should be ranked lower than node 1 which explicitly states the correct answer.",
Contextual Precision,1.0,Llama-3 70B,"The score is 1.00 because all the nodes in the retrieval context are perfectly ranked with the relevant node at rank 1, which clearly states the assigned readiness levels establish the priorities for work, and the irrelevant node at rank 2, which does not mention readiness levels or priorities for work at all, is correctly ranked lower.",
Contextual Precision,1.0,Llama-3 70B,"The score is 1.00 because all nodes in the retrieval context are relevant to the input and are correctly ranked at the top, as they both explicitly state the requirement for the Contractor to perform validation as required in the accepted TDMP.",
Contextual Precision,1.0,Llama-3 70B,"The score is 1.00 because all nodes in the retrieval context directly answer the question, with the first node explicitly stating the definition and the second node providing more related information, thus ranking all relevant nodes higher than any irrelevant nodes, resulting in a perfect score.",
Contextual Precision,1.0,Llama-3 70B,"The score is 1.00 because all nodes in the retrieval context are correctly ranked with the relevant nodes at the top. The first node, which clearly states Canada will validate the contractor",
Contextual Precision,1.0,Llama-3 70B,"The score is 1.00 because all the relevant nodes in the retrieval context are ranked higher than the irrelevant nodes, with the most relevant node being the first node which directly answers the question about adding an entry with no fields, and the irrelevant nodes are correctly placed at lower ranks, 2 and 3, due to their lack of relevance to the question.",
Contextual Precision,0.0,Llama-3 70B,"The score is 0.00 because there are no retrieval contexts to evaluate, so no ranking is possible to determine the precision score.",
Contextual Precision,0.0,Llama-3 70B,"The score is 0.00 because all the nodes in the retrieval context are irrelevant to the input, with the first node and second node both being irrelevant due to the reason that ",
Contextual Precision,0.0,Llama-3 70B,"The score is 0.00 because there are no retrieval contexts provided, hence no relevant nodes to rank higher than irrelevant nodes, resulting in a score of 0.00",
