metric,score,evaluation_model,reason,error
Contextual Precision,0.0,Llama-3 70B,"The score is 0.00 because all the nodes in the retrieval context are irrelevant to the input, with the first node and the second node both having reasons that they do not mention January 2003, instead talking about October 1999 which is not relevant to the expected output, hence they should be ranked lower than the relevant nodes, but there are no relevant nodes in this context, resulting in a score of 0.00",
Contextual Precision,1.0,Llama-3 70B,"The score is 1.00 because the single relevant node in the retrieval context, ranked 1, directly answers the question with ",
Contextual Precision,0.0,Llama-3 70B,"The score is 0.00 because all nodes in the retrieval context are irrelevant to the input, as they do not mention reaction wheels or momentum desaturation, but rather talk about GIADA and contamination monitor, which are unrelated to the input and expected output. The first node and the second node both have reasons that indicate they are not relevant to the input, so they should be ranked lower than relevant nodes, but there are no relevant nodes in this context, resulting in a score of 0.00",
Contextual Precision,1.0,Llama-3 70B,"The score is 1.00 because all nodes in the retrieval context are relevant to the input, and are correctly ranked at the top, with the first node providing a direct answer to the question and the second node supporting the idea of ensuring communications with the Earth throughout the mission, making it a perfect ranking.",
Contextual Precision,1.0,Llama-3 70B,"The score is 1.00 because all nodes in the retrieval context are relevant to the input and ranked correctly, with the first node mentioning ",
Contextual Precision,1.0,Llama-3 70B,"The score is 1.00 because all the relevant nodes in the retrieval context are ranked higher than the irrelevant nodes, with the first node directly answering the question about the main actuator for orbit around the comet nucleus, making it a perfect ranking.",
Contextual Precision,1.0,Llama-3 70B,"The score is 1.00 because the retrieval context contains only one node, which is relevant to the input, thus ranking it perfectly at the top position.",
Contextual Precision,1.0,Llama-3 70B,"The score is 1.00 because the only node in the retrieval context directly addresses the input question and is ranked first, making it a perfect match with no irrelevant nodes present. The node",
Contextual Precision,1.0,Llama-3 70B,"The score is 1.00 because all nodes in the retrieval context are relevant to the input, and they are all ranked correctly from the start, with the first node being a direct match and the second node providing supporting information, making it a perfect ranking with no irrelevant nodes ranked higher than relevant nodes.",
Contextual Precision,1.0,Llama-3 70B,"The score is 1.00 because all nodes in the retrieval context are relevant to the input and are ranked correctly, with the first node and second node both providing direct answers to the question about the accuracy of the backshield of a silicon solar cell, making them both highly relevant and deserving of their top rankings.",
