metric,score,evaluation_model,reason,error
Contextual Precision,1.0,Llama-3 70B,"The score is 1.00 because all nodes in the retrieval context are relevant to the input, with the first node directly addressing the question with a clear explanation.",
Contextual Precision,1.0,Llama-3 70B,"The score is 1.00 because all nodes in the retrieval context that directly answer the question are ranked higher than nodes that do not provide relevant information, such as node 2 which only provides an example approval date, and node 3 which talks about an unrelated topic, thus ensuring all relevant nodes are ranked at the top.",
Contextual Precision,1.0,Llama-3 70B,"The score is 1.00 because the single node in the retrieval context is relevant to the input and ranked first, making it a perfect match. The reason for this node being relevant is because ",
Contextual Precision,1.0,Llama-3 70B,"The score is 1.00 because all nodes in the retrieval context are perfectly ranked, with the most relevant node being at rank 1, directly addressing the question, and the irrelevant nodes being correctly placed at lower ranks, such as rank 2 and 3, which do not directly answer the question, thus resulting in a perfect contextual precision score.",
Contextual Precision,0.0,Llama-3 70B,"The score is 0.00 because all nodes in the retrieval context are irrelevant to the input, with the first node being a table of contents and the second node being a list of requirements for evidence management, both of which do not provide any relevant information about what practitioners should be provided with. As a result, the irrelevant nodes are ranked higher than relevant nodes, which is not ideal. There are no relevant nodes in the retrieval context to rank higher than the irrelevant nodes, hence the score is 0.00",
Contextual Precision,1.0,Llama-3 70B,"The score is 1.00 because all the nodes in the retrieval context that are directly relevant to the input are ranked higher than the nodes that are not directly related, such as the second node that only provides a broader context and the third node that is not directly related, ensuring that the most relevant information is prioritized.",
Contextual Precision,1.0,Llama-3 70B,"The score is 1.00 because all the nodes in the retrieval context are ranked correctly with all relevant nodes at the top. Each node in the retrieval context has a clear and direct relation to the input, as seen in nodes 1-5, making them all highly relevant and deserving of their top rankings.",
Contextual Precision,0.0,Llama-3 70B,"The score is 0.00 because all nodes in the retrieval context are irrelevant to the input, with the first node and the second node being ranked higher despite having no information about the focus of the 6 steps, only showing figures related to RE approaches.",
Contextual Precision,1.0,Llama-3 70B,"The score is 1.00 because the only node in the retrieval context is a direct answer to the input question, providing a clear explanation of what the function level corresponds to, thus ranking it as the top node at rank 1.",
Contextual Precision,1.0,Llama-3 70B,"The score is 1.00 because all irrelevant nodes in the retrieval context are correctly ranked lower than the relevant nodes, such as the second node ranked 2 and the third node ranked 3, which do not address the question about the flaws found in the function level requirements, whereas the first node ranked 1 directly provides the answer to the question. This perfect ranking results in a score of 1.00, indicating ideal contextual precision.",
Contextual Precision,1.0,Llama-3 70B,"The score is 1.00 because all the nodes in the retrieval context are correctly ranked as relevant, with the first node directly stating the aim of the survey and the second node providing additional context about the target audience of the survey, which is related to the aim, ensuring all relevant nodes are at the top of the ranking list.",
Contextual Precision,1.0,Llama-3 70B,"The score is 1.00 because all relevant nodes in the retrieval context are ranked higher than irrelevant nodes, with the first node directly answering the question, the second node providing more information about the component level, and the third node being irrelevant and correctly ranked lower.",
Contextual Precision,1.0,Llama-3 70B,"The score is 1.00 because all nodes in the retrieval context are relevant to the input and are ranked correctly, with the first node providing a direct definition of a business process.",
Contextual Precision,1.0,Llama-3 70B,"The score is 1.00 because all the relevant nodes in the retrieval context are ranked higher than the irrelevant nodes. The top two nodes explicitly mention the use cases of the OPENCOSS platform, providing direct evidence. The irrelevant nodes, starting from the third node, discuss unrelated topics, which should be ranked lower. Therefore, the model perfectly distinguishes between relevant and irrelevant nodes, achieving a perfect contextual precision score of 1.00.",
Contextual Precision,0.8333333333333333,Llama-3 70B,"The score is 0.83 because the top-ranked nodes in the retrieval context are relevant to the input, such as node 1 which directly answers the question, and node 3 which explains the purpose of the approach, but node 2 is an irrelevant node that should be ranked lower, which decreases the score.",
Contextual Precision,1.0,Llama-3 70B,"The score is 1.00 because all the irrelevant nodes in the retrieval context are correctly ranked lower than the relevant node at rank 1, which directly addresses the question about what is expected from the Lunar Exploration in imaging process, stating ",
Contextual Precision,1.0,Llama-3 70B,"The score is 1.00 because all nodes in the retrieval context are correctly ranked, with the first node highlighting the Lunar Exploration Light Rover",
Contextual Precision,1.0,Llama-3 70B,"The score is 1.00 because all nodes in the retrieval context are relevant to the input and are ranked accordingly, with each node providing a clear explanation of how the Lunar Exploration Light Rover supports on-board crew navigation, such as providing digital terrain maps and localization aids, situational awareness data, and determining position, heading and orientation, which are all directly related to the input question.",
Contextual Precision,1.0,Llama-3 70B,"The score is 1.00 because all relevant nodes in the retrieval context are perfectly ranked, with the top-ranked node being exactly what is required, and the irrelevant node being correctly placed lower in the ranking. The first node is spot on, while the second node is correctly deemed irrelevant due to the differing location mentioned in its reason, ",
Contextual Precision,1.0,Llama-3 70B,"The score is 1.00 because the single retrieval context node, ranked 1, has a ",
Contextual Precision,1.0,Llama-3 70B,"The score is 1.00 because all nodes in the retrieval context are relevant to the input and are ranked correctly, with the first node directly providing the answer to the question, stating ",
Contextual Precision,1.0,Llama-3 70B,"The score is 1.00 because all the relevant nodes in the retrieval context, such as node 1, which mentions the Lunar Exploration Light Rover can maintain a speed of 15 km/h, are ranked higher than the irrelevant nodes, like node 2, which does not provide information about the speed of the Lunar Exploration Light Rover on a smooth surface.",
Contextual Precision,1.0,Llama-3 70B,"The score is 1.00 because all nodes in the retrieval context are relevant and ranked correctly, as seen in the first node which explicitly states the required output of the Remote Control Station, providing operators with necessary information for teleoperation of the Lunar Exploration Light Rover. This demonstrates perfect contextual precision, with all relevant nodes ranked higher than any irrelevant nodes, which in this case, there are none.",
Contextual Precision,1.0,Llama-3 70B,"The score is 1.00 because the only node in the retrieval context is directly relevant to the input, providing the exact percentage the Lunar Exploration Light Rover shall determine its location to within, making it perfectly ranked.",
Contextual Precision,1.0,Llama-3 70B,"The score is 1.00 because all nodes in the retrieval context are relevant to the input, with the first node mentioning the direct relation of ",
Contextual Precision,1.0,Llama-3 70B,"The score is 1.00 because all irrelevant nodes in retrieval context are ranked lower than relevant nodes, with the first node being the most relevant one, which clearly defines the relative pointing error as pointing stability, and the second node does not provide any information about the relative pointing error being known as pointing stability, hence the perfect ranking is achieved.",
Contextual Precision,1.0,Llama-3 70B,"The score is 1.00 because all irrelevant nodes in the retrieval context are correctly ranked lower than the relevant nodes, ensuring perfect contextual precision. The first node in the retrieval context is the most relevant, directly answering the input question, whereas the second node is irrelevant, only providing a section title with no contribution to the answer.",
Contextual Precision,1.0,Llama-3 70B,"The score is 1.00 because all nodes in the retrieval context are relevant to the input, and thus, all nodes are ranked correctly, with the first node being the most relevant one.",
Contextual Precision,0.0,Llama-3 70B,"The score is 0.00 because there are no retrieval contexts provided, making it impossible to determine the relevance of any nodes to the input, resulting in a score of 0.00. The lack of retrieval contexts means there are no nodes to rank, hence the score cannot be higher than 0.00.",
Contextual Precision,0.5,Llama-3 70B,"The score is 0.50 because the first node in the retrieval context, which is an irrelevant node, is ranked equally with the second node, which directly answers the question, stating that the relative pointing error shall not exceed 3E-4 deg half cone angle over any 1 sec interval @ 95% confidence level during the comet nucleus observation phase. The irrelevant node",
Contextual Precision,1.0,Llama-3 70B,"The score is 1.00 because all nodes in the retrieval context are relevant and ranked accordingly, with the first node directly addressing the question and the second node providing additional context that helps in understanding the purpose of the functionality, hence all ",
Contextual Precision,1.0,Llama-3 70B,"The score is 1.00 because all nodes in the retrieval context are relevant to the input, and the relevant node is ranked first, which is perfect ranking order. The first node clearly states the launch year and mission name, which directly answers the input question.",
Contextual Precision,1.0,Llama-3 70B,"The score is 1.00 because all nodes in the retrieval context are relevant and accurately define the International Rosetta Mission, with the first node providing a clear definition, the second node supporting the mission",
Contextual Precision,1.0,Llama-3 70B,"The score is 1.00 because the retrieval context only contains one relevant node, which is ranked first, indicating a perfect ranking of relevant nodes over irrelevant nodes, which are absent in this case.",
Contextual Precision,0.5,Llama-3 70B,"The score is 0.50 because the first node in the retrieval context, which is irrelevant to the input, is ranked equally with the second node, which is highly relevant to the input, as it explicitly mentions the comet Wirtanen, which is the focus of the Rosetta mission study. The reason for the ",
Contextual Precision,1.0,Llama-3 70B,"The score is 1.00 because all the nodes in the retrieval context are correctly ranked as relevant, with the top-ranked nodes providing the required information about the two asteroids the spacecraft will pass close to, thus achieving a perfect ranking order. This is excellent!",
Contextual Precision,1.0,Llama-3 70B,"The score is 1.00 because all the nodes in the retrieval context are correctly ranked, with the first node providing a direct definition of Yield Loads, making it a perfect ranking order for the given input query.",
Contextual Precision,1.0,Llama-3 70B,"The score is 1.00 because all nodes in the retrieval context are relevant to the input, with the first node directly answering the question and the second node providing additional supporting details. This perfect ranking showcases the model",
Contextual Precision,1.0,Llama-3 70B,"The score is 1.00 because all the relevant nodes in the retrieval context are correctly ranked higher than the irrelevant nodes. Specifically, the first node in the retrieval context explicitly states the importance of understanding the relationship between asteroids, comets, and planetesimals throughout the solar nebula, making it a highly relevant result. Meanwhile, the second node is ranked lower as it only discusses spectral similarities between asteroids and comets, but does not provide direct information about the importance of understanding their relationship in the solar nebula, making it an irrelevant result.",
Contextual Precision,0.5,Llama-3 70B,"The score is 0.50 because the first node in the retrieval context, which is an irrelevant node, is ranked higher than the second node, which is a relevant node. Specifically, the first node is ranked first despite talking about the asteroid fly-by phase instead of the specific phase of asteroid and comet detection, whereas the second node is ranked second despite providing the exact information required, stating that the relative roll pointing error should not exceed 6E-3 deg over any 2 sec interval @ 95% confidence level during the comet nucleus observation phase, which is close enough to the asteroid and comet detection phase.",
Contextual Precision,1.0,Llama-3 70B,"The score is 1.00 because all the relevant nodes in the retrieval context are ranked higher than the irrelevant nodes, as seen in the first and second node which directly address the question, while the third node which does not provide the required information is ranked lower.",
Contextual Precision,1.0,Llama-3 70B,"The score is 1.00 because all nodes in the retrieval context, starting from the first node, are correctly ranked as relevant to the input, providing a direct answer to the question asked, with the first node stating that the tool will be mechanised to improve the consistency of the analysis.",
Contextual Precision,1.0,Llama-3 70B,"The score is 1.00 because all nodes in the retrieval context are perfectly ranked with the most relevant node, which directly answers the question, at rank 1, and the irrelevant nodes, discussing propulsion system and comet rendezvous phase, at ranks 2 and 3 respectively, are correctly placed below it, resulting in a perfect contextual precision score.",
Contextual Precision,1.0,Llama-3 70B,"The score is 1.00 because all the relevant nodes in the retrieval context, such as the first node which directly mentions the ",
Contextual Precision,1.0,Llama-3 70B,"The score is 1.00 because the only node in the retrieval context is relevant to the input, and it is ranked first, which is perfect ranking order. The reason provided for this node explains exactly how the Propulsion System prevents condensation of propellants, which aligns perfectly with the input question.",
Contextual Precision,1.0,Llama-3 70B,"The score is 1.00 because all nodes in the retrieval context are correctly ranked, with the first node providing the most relevant information about Rosetta, and the irrelevant nodes ranked lower at 2 and 3 respectively, as they do not provide any information about the Rosetta mission",
Contextual Precision,0.8333333333333333,Llama-3 70B,"The score is 0.83 because the first and third nodes in the retrieval context, which are relevant to the input, are ranked higher than the second node, which is an irrelevant node with the reason ",
Contextual Precision,0.0,Llama-3 70B,"The score is 0.00 because all nodes in the retrieval context are irrelevant to the input, with the first node mentioning unrelated tasks like conducting analyses of stock movements and the second node mentioning unrelated tasks like preparing and submitting disposal plans. Therefore, the irrelevant nodes are ranked higher than relevant nodes, resulting in a contextual precision score of 0.00.",
Contextual Precision,1.0,Llama-3 70B,"The score is 1.00 because all relevant nodes in the retrieval context are ranked higher than irrelevant nodes. The first node and the second node are directly related to the input, while the third node is not related to the input, and is correctly ranked lower. The reasons provided for the first and second nodes explicitly state that the contractor must count the number of items that are unaccounted for and calculate the percentage of items that are unaccounted for against the total number of items held and in transit, which is exactly what the input asks for, while the third node talks about stocktaking of all DND loaned materiel, which is not related to the input",
Contextual Precision,1.0,Llama-3 70B,"The score is 1.00 because all nodes in the retrieval context are correctly ranked, with the first node directly answering the question and the second node being irrelevant to the input question, thus resulting in a perfect ranking order.",
Contextual Precision,1.0,Llama-3 70B,"The score is 1.00 because all irrelevant nodes are correctly ranked lower than the relevant node at rank 1, which is supported by the reason ",
Contextual Precision,1.0,Llama-3 70B,"The score is 1.00 because all the relevant nodes in the retrieval context, like the first node stating that ",
Contextual Precision,1.0,Llama-3 70B,"The score is 1.00 because the retrieval context perfectly ranks the relevant nodes, with the first node directly addressing the question and providing the required information, making it a perfect retrieval context ranking.",
Contextual Precision,0.0,Llama-3 70B,"The score is 0.00 because there are no retrieval contexts to evaluate, hence no ranking of nodes in retrieval context to assess the contextual precision score from. Therefore, it is impossible to determine if the relevant nodes are ranked higher than the irrelevant nodes in retrieval context, resulting in a score of 0.00.",
Contextual Precision,0.8333333333333333,Llama-3 70B,"The score is 0.83 because all the relevant nodes in the retrieval context, such as node 1 and node 3, are ranked higher than the irrelevant node 2, which talks about counting the number of items instead of calculating their value, which is not the same thing. The model is doing a good job in distinguishing between relevant and irrelevant information, but there is still room for improvement to reach a perfect score of 1.00.",
Contextual Precision,1.0,Llama-3 70B,"The score is 1.00 because all nodes in the retrieval context are relevant to the input and are ranked accordingly, with the most relevant node being ranked first and providing a direct answer to the question, and the second node providing additional related information, hence all irrelevant nodes are ranked lower than relevant nodes, resulting in a perfect score of 1.00.",
Contextual Precision,1.0,Llama-3 70B,"The score is 1.00 because all the relevant nodes in the retrieval context, like the first node which explicitly states the required provision of In-Service Support on the HCCS Equipment Group installed in all twelve Halifax-class ships, are ranked higher than the irrelevant nodes, such as the second node which discusses the development of an AOP based on operational readiness levels for each Halifax-class ship, which is unrelated to the required provision of In-Service Support, thus ensuring perfect contextual precision.",
Contextual Precision,0.125,Llama-3 70B,"The score is 0.12 because the model ranks many irrelevant nodes higher than relevant nodes, such as node 1, 2, 3, 4, 5, 6, and 7, which are not related to what the Contractor must report, and only ranks the relevant node 8 at a lower position, indicating that the model has a low contextual precision score, as it fails to prioritize the relevant nodes over the irrelevant ones.",
Contextual Precision,1.0,Llama-3 70B,"The score is 1.00 because all nodes in the retrieval context are relevant to the input, perfectly aligning with the question, and are ranked correctly from the start, with the first node directly answering the question, providing a clear explanation for the required identification of changes to the skills and competency by the Contractor.",
Contextual Precision,1.0,Llama-3 70B,"The score is 1.00 because all nodes in the retrieval context are perfectly ranked, with the most relevant node being ranked first and the irrelevant node being ranked second, which is exactly what we want to see. The first node is directly answering the question, while the second node is not providing any relevant information, so it",
Contextual Precision,1.0,Llama-3 70B,"The score is 1.00 because all retrieval contexts are perfectly ranked, with the first node in the retrieval context providing a direct answer to the input question, thus demonstrating a flawless contextual precision score. Well done! The retrieval context is perfectly aligned with the input, and the node is ranked first as it should be, resulting in a perfect score of 1.00. The context clearly states that the Contractor must establish and maintain HCCS disposal processes for HCCS EG systems, parts and consumables, which is the expected output.",
Contextual Precision,1.0,Llama-3 70B,"The score is 1.00 because all the nodes in the retrieval context are relevant to the input, and they are all ranked correctly at the top, making it a perfect ranking. The first node clearly addresses the question, stating that the HCCS equipment will be subject to obsolescence issues during its service life, which perfectly aligns with the input question, hence it is ranked first.",
Contextual Precision,1.0,Llama-3 70B,"The score is 1.00 because the retrieval context correctly ranks the only relevant node at rank 1, perfectly aligning with the input question, showcasing an ideal retrieval context scenario where all nodes are accurately prioritized, resulting in a perfect score of 1.00",
Contextual Precision,1.0,Llama-3 70B,"The score is 1.00 because all nodes in the retrieval context are correctly ranked, with the most relevant information at the top. The first node explicitly states the authority of Formation Commanders and Fleet Commanders, and the second node further supports this by mentioning their specific roles, making them both highly relevant to the input question.",
Contextual Precision,1.0,Llama-3 70B,"The score is 1.00 because all the relevant nodes in the retrieval context are ranked higher than the irrelevant nodes. Specifically, the first node, which clearly connects ",
Contextual Precision,0.75,Llama-3 70B,"The score is 0.75 because the top 2 nodes in the retrieval context are relevant to the input, but then 2 irrelevant nodes are ranked higher than the 3rd relevant node, and another 2 irrelevant nodes are ranked higher than the 4th relevant node. The 3rd node says ",
Contextual Precision,1.0,Llama-3 70B,"The score is 1.00 because all nodes in the retrieval context are relevant to the input, and they are ranked perfectly, with the first node being directly related to the question asked, stating that Canada may add or remove support locations for the HCCS EG, making it a perfect match.",
Contextual Precision,1.0,Llama-3 70B,"The score is 1.00 because all nodes in the retrieval context are perfectly ranked, with the most relevant node at rank 1 stating that the Contractor must work collaboratively to develop a Standard Ship Maintenance and Repair Specification and ECs for the HCCS EG, which directly answers the question, and the irrelevant node at rank 2 is correctly placed lower due to being unrelated to the question of why the Contractor must work collaboratively with the Halifax-class Program Manager and its Halifax-class Design Agent Contractor.",
Contextual Precision,1.0,Llama-3 70B,"The score is 1.00 because all nodes in the retrieval context are correctly ranked, with the first node clearly stating the purpose of Performance Assessment, making it a perfect ranking order.",
Contextual Precision,1.0,Llama-3 70B,"The score is 1.00 because all nodes in the retrieval context are correctly ranked, with the first node being directly related to the input, and no irrelevant nodes are ranked higher than relevant ones. The first node explicitly states the correct process of adding an entry on the database by clicking add entry on the main menu, which matches the input perfectly. This perfect ranking results in a score of 1.00, indicating excellent contextual precision.",
Contextual Precision,1.0,Llama-3 70B,"The score is 1.00 because all nodes in the retrieval context are relevant to the input and are ranked correctly, with the most relevant node ranked first and the second most relevant node ranked second, resulting in perfect ranking of relevant nodes over irrelevant nodes, which are nonexistent in this case. The first node explicitly answers the question, while the second node provides supporting information, further solidifying the relevance of the nodes to the input.",
Contextual Precision,0.0,Llama-3 70B,"The score is 0.00 because there are no retrieval contexts provided to evaluate the contextual precision score, making it impossible to determine if the relevant nodes are ranked higher than the irrelevant nodes in the retrieval contexts.",
Contextual Precision,1.0,Llama-3 70B,"The score is 1.00 because all relevant nodes in the retrieval context, like the first and second nodes, are ranked higher than the irrelevant nodes, like the third and fourth nodes, as they provide direct information about the Lunar Exploration Light Rover",
