metric,score,evaluation_model,reason,error
Contextual Precision,1.0,Llama-3 70B,"The score is 1.00 because all nodes in the retrieval context are relevant to the input and are ranked correctly, with the most relevant node being the first node which directly answers the question, providing the exact authority responsible for assigning the AMCS number.",
Contextual Precision,1.0,Llama-3 70B,The score is 1.00 because all the nodes in the retrieval context with ,
Contextual Precision,0.0,Llama-3 70B,"The score is 0.00 because there are no retrieval contexts provided, making it impossible to determine the relevance of the nodes and thus the ranking precision cannot be calculated. As a result, the score is at its lowest possible value of 0.00.",
Contextual Precision,0.8333333333333333,Llama-3 70B,"The score is 0.83 because the top two nodes in the retrieval context are relevant to the input, with the first node directly addressing the question and the second node being irrelevant, and the third node being relevant again, indicating that the model is generally able to rank relevant nodes higher than irrelevant nodes, but not consistently so, as seen with the second node being ranked higher than it should be.",
Contextual Precision,0.0,Llama-3 70B,"The score is 0.00 because all nodes in the retrieval context are irrelevant, with the first node being about contractors and operation, and the second node being about tools for evidence management, which are both unrelated to practitioners dealing with activities effectively and efficiently. Therefore, there are no relevant nodes ranked higher than irrelevant nodes, resulting in a score of 0.00.",
Contextual Precision,1.0,Llama-3 70B,"The score is 1.00 because the retrieval context is perfectly ranked, with the only node in the retrieval context being directly relevant to the input question, as stated in the node",
Contextual Precision,1.0,Llama-3 70B,"The score is 1.00 because all nodes in the retrieval context are relevant to the input and are correctly ranked in order of relevance, with the most relevant node ranked first. The first node explicitly outlines the steps involved in the overall approach, making it a perfect match for the input query.",
Contextual Precision,0.0,Llama-3 70B,"The score is 0.00 because the first and second nodes in the retrieval context are irrelevant nodes, with reasons being ",
Contextual Precision,1.0,Llama-3 70B,"The score is 1.00 because all nodes in the retrieval context are relevant to the input, with the first node directly addressing the question and providing a clear explanation, thus resulting in perfect ranking of relevant nodes over irrelevant nodes, which are none in this case.",
Contextual Precision,1.0,Llama-3 70B,"The score is 1.00 because all nodes in the retrieval context are relevant to the input, and they are ranked perfectly with the most relevant nodes first, resulting in a perfect ranking order and thus a perfect contextual precision score. The first node explains the flaws in the function level requirements, and the second node further elaborates on the same flaws, providing a cohesive and logical explanation. This demonstrates a seamless connection between the input and the retrieval contexts, leading to a perfect score.",
Contextual Precision,1.0,Llama-3 70B,"The score is 1.00 because all nodes in the retrieval context are correctly ranked, with the most relevant information about the aim of the survey at rank 1 and 2. The first node directly answers the question, while the second node provides additional context about the target audience and challenges of providing evidence, making them both highly relevant to the input question. This perfect ranking results in a perfect contextual precision score of 1.00",
Contextual Precision,1.0,Llama-3 70B,"The score is 1.00 because all nodes in the retrieval context are relevant to the input and are correctly ranked, with the first node providing a clear definition of the component level, the second node providing additional information about the component level, and the third node explaining the functional areas of component level requirements. The nodes are perfectly ranked, with the most relevant information at the top and the least relevant at the bottom, resulting in a perfect contextual precision score of 1.00.",
Contextual Precision,1.0,Llama-3 70B,"The score is 1.00 because the only node in the retrieval context is perfectly relevant to the input, directly defining what a business process is, which aligns perfectly with the expected output, hence ranked first, making the score a perfect 1.00. This is ideal as it ensures the most relevant information is presented to the user first, which is exactly what is needed in this case. The user gets the precise answer they are looking for immediately, which is fantastic for their search experience. This is the best-case scenario, and we should strive for this in all our search results. The user will be extremely satisfied with the result and will likely return to our service for their future queries. This is a huge win for our service and a testament to its capabilities.",
Contextual Precision,1.0,Llama-3 70B,"The score is 1.00 because all relevant nodes in the retrieval context, like the first and second nodes, are correctly ranked higher than irrelevant nodes, like the third, fourth, fifth, sixth, and seventh nodes, which have reasons that explicitly exclude or are not directly related to the OPENCOSS platform. This perfect ranking is achieved because the model accurately identifies the interactions between the OPENCOSS platform and its users for evidence management, as mentioned in the reasons of the top-ranked nodes, and correctly distinguishes them from the irrelevant nodes with reasons that are not directly related to the platform or are explicitly excluded as targets of the platform.",
Contextual Precision,1.0,Llama-3 70B,"The score is 1.00 because all relevant nodes in the retrieval context are ranked higher than irrelevant nodes, with the first node providing a direct answer to the input question, and the second and third nodes providing no relevant information to answer the question, thus resulting in a perfect ranking.",
Contextual Precision,1.0,Llama-3 70B,"The score is 1.00 because all the relevant nodes in the retrieval context are correctly ranked higher than the irrelevant nodes. Specifically, the first node in the retrieval context directly addresses the question, and the subsequent nodes do not, which is reflected in their rankings.",
Contextual Precision,1.0,Llama-3 70B,"The score is 1.00 because all nodes in the retrieval context are relevant to the input and are ranked correctly, with the first node clearly addressing the question and the second node reiterating the requirement for turn-in-place capability, which is a key aspect of the High Manoeuvrability Options for the Lunar Exploration Light Rover.",
Contextual Precision,1.0,Llama-3 70B,"The score is 1.00 because all the nodes in the retrieval context that directly address the question are ranked higher than the nodes that are not directly relevant to the question, with the first node providing a clear answer and the subsequent nodes being correctly ranked lower due to being less relevant.",
Contextual Precision,1.0,Llama-3 70B,"The score is 1.00 because all the irrelevant nodes in the retrieval context are correctly ranked lower than the relevant nodes. For instance, the second node is correctly ranked lower because it suggests a different location, the Exploration Development and Operations Center, which is not the correct answer. This perfect ranking results in a perfect score of 1.00, indicating the model",
Contextual Precision,1.0,Llama-3 70B,"The score is 1.00 because the single relevant node in the retrieval context is ranked first, directly addressing the input question and providing a clear answer, making it a perfect match.",
Contextual Precision,1.0,Llama-3 70B,"The score is 1.00 because all nodes in the retrieval context are relevant and ranked correctly, providing the required information directly and accurately, such as the first node stating the rollover threshold is at least 36.9° (0.75 g).",
Contextual Precision,1.0,Llama-3 70B,"The score is 1.00 because all irrelevant nodes in the retrieval context are correctly ranked lower than the relevant nodes. For example, the first node, which directly answers the question about the Lunar Exploration Light Rover",
Contextual Precision,1.0,Llama-3 70B,"The score is 1.00 because all the nodes in the retrieval context are relevant and perfectly match the input, ranking them correctly at the top with no irrelevant nodes present.",
Contextual Precision,1.0,Llama-3 70B,"The score is 1.00 because all nodes in the retrieval context are relevant to the input, with the first node directly answering the question with a clear and concise explanation, making it perfectly ranked.",
Contextual Precision,0.0,Llama-3 70B,"The score is 0.00 because all nodes in the retrieval context are irrelevant, with the first node stating ",
Contextual Precision,1.0,Llama-3 70B,"The score is 1.00 because the single retrieval context node is relevant to the input, with the reason clearly stating the answer, and thus is ranked first, as it should be, achieving perfect contextual precision.",
Contextual Precision,1.0,Llama-3 70B,"The score is 1.00 because all the relevant nodes in the retrieval context are perfectly ranked, with the first node directly addressing the question and providing the required information, and the irrelevant node being correctly placed lower in the ranking.",
Contextual Precision,1.0,Llama-3 70B,"The score is 1.00 because all nodes in the retrieval context are relevant to the input, and they are ranked perfectly with the first node being the most relevant one, providing a direct answer to the question asked.",
Contextual Precision,1.0,Llama-3 70B,"The score is 1.00 because all nodes in the retrieval context are relevant, and thus, are ranked perfectly, with the first node being highly relevant to the input, stating that routine functions shall be possible to run in the absence of failure detection software, which aligns perfectly with the input",
Contextual Precision,1.0,Llama-3 70B,"The score is 1.00 because all the relevant nodes in the retrieval context, such as the first node, are correctly ranked higher than the irrelevant nodes, as the given reason for the first node explicitly answers the input question while the second node",
Contextual Precision,1.0,Llama-3 70B,"The score is 1.00 because all the nodes in the retrieval context are relevant to the input and are ranked correctly, with the most relevant nodes at the top. For instance, the first node directly answers the question, and the second node provides supporting information, both of which are highly relevant to the input, thus they are ranked at the top correctly, resulting in a perfect contextual precision score of 1.00",
Contextual Precision,1.0,Llama-3 70B,"The score is 1.00 because all nodes in the retrieval context, such as node 1, directly match the input, providing a perfect ranking of relevant nodes over irrelevant nodes, which are nonexistent in this case.",
Contextual Precision,1.0,Llama-3 70B,"The score is 1.00 because all the nodes in the retrieval context are perfectly ranked, with the first node directly answering the question, and the second node providing additional details but not directly answering the question, hence the perfect ranking of relevant nodes over irrelevant nodes.",
Contextual Precision,1.0,Llama-3 70B,"The score is 1.00 because all irrelevant nodes in the retrieval context are correctly ranked lower than the relevant node, which is the first node, with the reason ",
Contextual Precision,0.5,Llama-3 70B,"The score is 0.50 because the first node in the retrieval context, which is irrelevant to the input, is ranked equally with the second node, which is relevant to the input, indicating that the model has not fully distinguished between relevant and irrelevant nodes. The first node is ranked high despite having reasons such as ",
Contextual Precision,1.0,Llama-3 70B,"The score is 1.00 because all retrieval context nodes, including the first node which states ",
Contextual Precision,1.0,Llama-3 70B,"The score is 1.00 because all nodes in the retrieval context are perfectly ranked, with the first node providing a direct definition of Yield Loads, which exactly matches the question",
Contextual Precision,1.0,Llama-3 70B,"The score is 1.00 because all retrieval contexts are perfectly ranked, with the first node directly stating the requirement and the second node providing additional relevant information, making it a perfect ranking order for the input query. The contextual precision is at its highest because all nodes are relevant and correctly ranked, making it an ideal retrieval context scenario.",
Contextual Precision,1.0,Llama-3 70B,"The score is 1.00 because all retrieval context nodes are perfectly ranked, with the most relevant node being ranked first and the irrelevant node being ranked second. The first node directly answers the question, while the second node is not directly related to the question, thus justifying its lower rank. This perfect ranking results in a score of 1.00, indicating that the model is able to effectively differentiate between relevant and irrelevant nodes and rank them accordingly.",
Contextual Precision,0.5,Llama-3 70B,"The score is 0.50 because the second node in the retrieval context is correctly ranked higher than the first node, as the context clearly states the specific error limit during the comet nucleus observation phase, but the first node is ranked too high, as it does not mention the relevant phase, and thus should be ranked lower than the relevant node, which is correctly ranked at 2nd place, resulting in a precision score of 0.50.",
Contextual Precision,1.0,Llama-3 70B,"The score is 1.00 because all the nodes in the retrieval context that are relevant to the input are ranked higher than the irrelevant nodes. The first and second nodes in the retrieval context directly provide the answer to the question, while the third node does not. As a result, the relevant nodes are correctly ranked higher than the irrelevant node at rank 3, resulting in a perfect contextual precision score.",
Contextual Precision,1.0,Llama-3 70B,"The score is 1.00 because the retrieval context has only one node, which is directly relevant to the input, and is ranked first, making it perfectly precise.",
Contextual Precision,0.5,Llama-3 70B,"The score is 0.50 because the first node in the retrieval context, which is irrelevant, is ranked equally with the second node, which is relevant. The first node should be ranked lower since it only talks about orbit manoeuvre strategy without mentioning the function of Major orbit manoeuvres, whereas the second node explicitly states the function of Major orbit manoeuvres, implying that it is more relevant to the input question.",
Contextual Precision,1.0,Llama-3 70B,"The score is 1.00 because all nodes in the retrieval context are relevant to the input, and are ranked correctly. The first node explicitly states the confidence level during the comet nucleus observation phase, the second node directly mentions it, and the third node also relates to the confidence level during this phase. Therefore, all irrelevant nodes are correctly ranked lower than the relevant nodes, resulting in a perfect score.",
Contextual Precision,1.0,Llama-3 70B,"The score is 1.00 because all nodes in the retrieval context are relevant to the input, with the first node directly addressing the question with a clear explanation, making it perfectly ranked.",
Contextual Precision,1.0,Llama-3 70B,"The score is 1.00 because all the irrelevant nodes in the retrieval context are ranked lower than the relevant ones, which is perfect! The first node is a direct match and the second node is not relevant, so it",
Contextual Precision,1.0,Llama-3 70B,"The score is 1.00 because all the relevant nodes in the retrieval context, such as node 1, are correctly ranked higher than the irrelevant nodes, like nodes 2 and 3, which do not provide any information about developing Ecs using systems engineering processes, as stated in their reasons, ",
Contextual Precision,0.0,Llama-3 70B,"The score is 0.00 because all retrieval context nodes are irrelevant to the input, with the first node discussing stock movements and reporting, the second node discussing source documents and clearances, and the third node discussing Government Property Management and physical audits, none of which are related to what the Contractor must conduct and provide to Canada. As a result, there are no relevant nodes ranked higher than irrelevant nodes, resulting in a score of 0.00",
Contextual Precision,1.0,Llama-3 70B,"The score is 1.00 because all nodes in the retrieval context are perfectly ranked, with the first two nodes directly answering the question and the third node being irrelevant, ranked lower as it should be, addressing a different topic altogether, at rank 3.",
Contextual Precision,1.0,Llama-3 70B,"The score is 1.00 because all the relevant nodes in the retrieval context are ranked higher than the irrelevant nodes, with the first node providing a direct answer to the input question and the second node being correctly ranked lower due to its lack of information about where the maintenance activities assigned to RCN are defined, as stated in its reason ",
Contextual Precision,1.0,Llama-3 70B,"The score is 1.00 because all the irrelevant nodes in the retrieval contexts, like the second node, are correctly ranked lower than the relevant nodes, such as the first node, which explicitly states the expected output of making available associated plans, processes, procedures, instructions and data to Canada upon request, as per the input query.",
Contextual Precision,1.0,Llama-3 70B,"The score is 1.00 because all retrieval context nodes are correctly ranked, with the most relevant node at rank 1, stating that ",
Contextual Precision,1.0,Llama-3 70B,"The score is 1.00 because all the nodes in the retrieval context are relevant and correctly ranked, with the first node providing a clear explanation of what the EC System Requirement Document (EC SRD) specifies.",
Contextual Precision,0.0,Llama-3 70B,"The score is 0.00 because there are no retrieval contexts to evaluate, resulting in a score of 0.00, which is the lowest possible score. This is because the retrieval contexts list is empty, meaning there are no nodes to evaluate and rank, making it impossible to determine the relevance of nodes to the input query, thus resulting in a score of 0.00..",
Contextual Precision,1.0,Llama-3 70B,"The score is 1.00 because all the nodes in the retrieval context are relevant to the input, and are correctly ranked as they directly address the question, providing explicit and clear information about how the contractor can support the performance indicators using the Contractor Held Inventory report. The first node explicitly states the review process, the second node clearly states the counting process, and the third node directly addresses the question with the calculation process, making them all highly relevant and deserving of their top ranks.",
Contextual Precision,1.0,Llama-3 70B,"The score is 1.00 because all the nodes in the retrieval context are correctly ranked, with the most relevant node (node 1) directly addressing the input question and the less relevant node (node 2) ranked lower, demonstrating perfect contextual precision. The retrieval context is perfectly ordered, ensuring that the most relevant information is presented first, which is exactly what the user needs. This is ideal for providing accurate answers to the user",
Contextual Precision,1.0,Llama-3 70B,"The score is 1.00 because all the relevant nodes in the retrieval context, such as the first node which directly answers the question, are perfectly ranked higher than the irrelevant nodes, ensuring accurate results for the input query.",
Contextual Precision,0.14285714285714285,Llama-3 70B,"The score is 0.14 because the model ranks many irrelevant nodes higher than the relevant ones, such as node 1, node 2, node 3, node 4, node 5, and node 6, which have reasons like ",
Contextual Precision,1.0,Llama-3 70B,"The score is 1.00 because all retrieval context nodes, including the first node, have a ",
Contextual Precision,1.0,Llama-3 70B,"The score is 1.00 because all nodes in the retrieval context are perfectly ranked, with the most relevant node at rank 1 directly answering the question, and the irrelevant node at rank 2 correctly placed below it due to being not relevant to the topic of maintenance activities assigned to the FMFs and their definition in the HCCS EG maintenance program.",
Contextual Precision,1.0,Llama-3 70B,"The score is 1.00 because all the nodes in the retrieval context are relevant to the input and are ranked accordingly, with the first node directly answering the question with clear context. This perfect ranking demonstrates exceptional contextual precision.",
Contextual Precision,1.0,Llama-3 70B,"The score is 1.00 because all nodes in the retrieval context are relevant to the input, with the first node directly answering the question and providing a clear explanation, making it a perfect ranking.",
Contextual Precision,1.0,Llama-3 70B,"The score is 1.00 because the single node in the retrieval context is relevant to the input, and thus, ranked correctly at 1st position, as it directly answers the question asked, ensuring perfect contextual precision.",
Contextual Precision,1.0,Llama-3 70B,"The score is 1.00 because all retrieval context nodes are correctly ranked, with the most relevant nodes at the top, providing direct answers to the input question with supporting reasons.",
Contextual Precision,1.0,Llama-3 70B,"The score is 1.00 because the retrieval context perfectly ranks the relevant node at rank 1, which explicitly defines technical data with a precise phrase, making it a perfect match for the input question.",
Contextual Precision,1.0,Llama-3 70B,"The score is 1.00 because all relevant nodes in the retrieval context are ranked higher than irrelevant nodes, with the first node being directly relevant to the input question and the subsequent nodes being irrelevant, thus achieving perfect contextual precision.",
Contextual Precision,1.0,Llama-3 70B,"The score is 1.00 because all nodes in the retrieval context are relevant and correctly ranked at the top, with the first node being directly on point with the input question, stating that ",
Contextual Precision,1.0,Llama-3 70B,"The score is 1.00 because all the nodes in the retrieval context are correctly ranked, with the highly relevant node at rank 1 explicitly stating the required collaborative work, and the irrelevant node at rank 2 discussing unrelated context, resulting in a perfect ranking of relevant nodes above irrelevant nodes in the retrieval context",
Contextual Precision,1.0,Llama-3 70B,"The score is 1.00 because all the relevant nodes in the retrieval context, like node 1, are ranked higher than irrelevant nodes, as they directly address the question asked, providing the exact purpose of Performance Assessment, while irrelevant nodes, like node 2, are correctly ranked lower as they do not directly provide the purpose of Performance Assessment, even though they are related to it.",
Contextual Precision,1.0,Llama-3 70B,"The score is 1.00 because all retrieval context nodes are correctly ranked with the relevant node at rank 1, as the node explicitly states the correct answer, and the irrelevant node at rank 2 is correctly ranked lower due to its unrelated context about data flow and stimulus/response sequences, which is not directly related to adding a new entry on the database by clicking add entry on the main menu.",
Contextual Precision,1.0,Llama-3 70B,"The score is 1.00 because all nodes in the retrieval context are ranked correctly, with the first node explicitly stating the benefits of 360° imaging and the second node further supporting this by highlighting its relevance to locomotion around the rover, resulting in perfect contextual precision.",
Contextual Precision,0.0,Llama-3 70B,"The score is 0.00 because there are no retrieval contexts provided, so it is impossible to determine if relevant nodes are ranked higher than irrelevant nodes in the retrieval context list, which is necessary for calculating the contextual precision score. As a result, the score is 0.00, indicating a complete lack of contextual precision in the retrieval context list provided..",
Contextual Precision,1.0,Llama-3 70B,"The score is 1.00 because all relevant nodes in the retrieval context are ranked higher than the irrelevant nodes. For example, the first node mentions the need for interfaces for the on-board crew to control all functions, which implies the need for navigation, and is correctly ranked as the top node. Similarly, the second and third nodes also directly relate to on-board crew navigation and are ranked accordingly. The fourth node, which is ranked lowest, talks about shock exposure and acceleration, which is unrelated to on-board crew navigation, and is correctly ranked as the last node.",
Contextual Precision,1.0,Llama-3 70B,"The score is 1.00 because all retrieval contexts are relevant and correctly ranked at the top, with the first node providing a clear definition of Tele-Operation mode that matches the expected output exactly, making it a perfect match.",
Contextual Precision,0.0,Llama-3 70B,"The score is 0.00 because there are no retrieval contexts to evaluate, resulting in a score of 0.00",
