metric,score,evaluation_model,reason,error
Contextual Precision,1.0,Llama-3 70B,"The score is 1.00 because the only irrelevant node in the retrieval context, ranked 2, has a reason stating it doesn",
Contextual Precision,1.0,Llama-3 70B,"The score is 1.00 because all retrieval contexts are correctly ranked, with the relevant node at rank 1 explicitly stating DND",
Contextual Precision,1.0,Llama-3 70B,"The score is 1.00 because all irrelevant nodes in the retrieval context are correctly ranked lower than relevant nodes, with the first node being directly relevant to the input question and the second node being less relevant due to not mentioning the specific requirement of delivering training at DND facilities, as stated in its reason ",
Contextual Precision,1.0,Llama-3 70B,"The score is 1.00 because all nodes in the retrieval context are relevant to the input and ranked correctly, with the first node directly addressing the question about Government Property. The reason provided in the first node, ",
Contextual Precision,1.0,Llama-3 70B,"The score is 1.00 because all retrieval context nodes, ranked 1, 2, and 3, are relevant to the input, providing strong evidence that the HCCS EG is supportable throughout, as they all explicitly state or imply this fact, making it a perfect ranking with no irrelevant nodes above relevant ones.",
Contextual Precision,1.0,Llama-3 70B,"The score is 1.00 because all nodes in the retrieval context are correctly ranked, with the most relevant node being the first node, which directly states the required governance structure, and the irrelevant node being the second node, which talks about security risk methodology and its components, thus ensuring effective and integrated security risk management is achieved.",
Contextual Precision,1.0,Llama-3 70B,"The score is 1.00 because all the relevant nodes in the retrieval context, like node 1, are correctly ranked higher than the irrelevant nodes, with quotes from the context supporting the ",
Contextual Precision,1.0,Llama-3 70B,"The score is 1.00 because all nodes in the retrieval context are perfectly relevant to the input, with each node explicitly stating the required action of the Contractor in the accepted TDMP, ranking them correctly at 1 and 2 respectively, showcasing a flawless retrieval context ranking system.",
Contextual Precision,1.0,Llama-3 70B,"The score is 1.00 because all nodes in the retrieval context are relevant and correctly ranked, with the first node directly answering the question and the second node further clarifying the scope of TDMIS, demonstrating a perfect ranking of relevant nodes over irrelevant ones, which doesn",
Contextual Precision,1.0,Llama-3 70B,"The score is 1.00 because all retrieval context nodes are correctly ranked with the relevant nodes at the top, as seen in node 1 and 2 which directly and indirectly answer the question, respectively, and thus are placed above any irrelevant nodes which are non-existent in this case, resulting in perfect contextual precision.",
Contextual Precision,1.0,Llama-3 70B,The score is 1.00 because all nodes in the retrieval context with ,
Contextual Precision,0.0,Llama-3 70B,"The score is 0.00 because there are no retrieval contexts to evaluate, so there is no opportunity for relevant nodes to be ranked higher than irrelevant nodes in the retrieval context list.",
Contextual Precision,0.0,Llama-3 70B,"The score is 0.00 because all the top ranked nodes in the retrieval context are irrelevant, specifically nodes 1 and 2, which have reasons ",
Contextual Precision,0.0,Llama-3 70B,"The score is 0.00 because there are no retrieval contexts provided to calculate the precision score from. Therefore, it is not possible to determine if the relevant nodes are ranked higher than the irrelevant nodes in the retrieval contexts, resulting in a score of 0.00..",
Contextual Precision,0.0,Llama-3 70B,"The score is 0.00 because both nodes in the retrieval context are irrelevant to the input, with the first node mentioning October 1999 and the second node also mentioning October 1999, which are both not related to the launch date inquired about in the input. As a result, the irrelevant nodes are ranked higher than the relevant nodes, which should not be the case for a higher contextual precision score.",
Contextual Precision,1.0,Llama-3 70B,"The score is 1.00 because all nodes in the retrieval context are ranked perfectly with the most relevant nodes at the top, with the first node and second node both directly mentioning ",
Contextual Precision,0.0,Llama-3 70B,"The score is 0.00 because all nodes in the retrieval context are irrelevant to the input, with the first node mentioning contamination monitor and dust velocity measurement, which are not related to momentum desaturation, hence ranked higher than relevant nodes, which are non-existent in this case.",
Contextual Precision,1.0,Llama-3 70B,"The score is 1.00 because all retrieval contexts are correctly ranked with the most relevant nodes at the top. The first node is directly addressing the question with the required spacecraft design, while the second node is less relevant as it",
Contextual Precision,1.0,Llama-3 70B,"The score is 1.00 because all the relevant nodes in the retrieval context are ranked higher than the irrelevant nodes, with the first node directly addressing the question and providing a clear answer, and the second node not providing a direct answer, hence ranked lower accordingly. This perfect ranking results in a perfect contextual precision score of 1.00",
Contextual Precision,1.0,Llama-3 70B,"The score is 1.00 because the relevant node at rank 1 directly answers the question, while the irrelevant node at rank 2 is correctly ranked lower due to being not directly related to the main actuator for orbit around the comet nucleus as stated in the reason ",
Contextual Precision,1.0,Llama-3 70B,"The score is 1.00 because all the nodes in the retrieval context are relevant to the input, and thus ranked perfectly in order of relevance, with the first node being directly related to the input and expected output, as it explicitly mentions ",
Contextual Precision,1.0,Llama-3 70B,"The score is 1.00 because the retrieval context is perfectly ranked, with the highly relevant node at rank 1 having a reason that perfectly aligns with the input question, ensuring a flawless contextual precision score.",
Contextual Precision,1.0,Llama-3 70B,"The score is 1.00 because all nodes in the retrieval context are ranked correctly, with the first node explicitly stating the requirement and the second node providing further details, ensuring all irrelevant nodes are ranked lower than relevant nodes, resulting in a perfect contextual precision score.",
Contextual Precision,1.0,Llama-3 70B,"The score is 1.00 because all nodes in the retrieval context are correctly ranked with the relevant nodes at the top, as the first node explicitly answers the question about the backshield of a silicon solar cell, and the second node further solidifies the accuracy, making the ranking perfect and precise.",
