metric,score,evaluation_model,reason,error
Contextual Precision,1.0,Llama-3 70B,"The score is 1.00 because all the nodes in the retrieval context are relevant to the input, and they are ranked correctly with the most relevant node at rank 1, as the node directly answers the question and provides a clear rationale for the angle requirement. The retrieval context is perfectly aligned with the input, resulting in a perfect score of 1.00",
Contextual Precision,1.0,Llama-3 70B,"The score is 1.00 because all retrieval contexts are correctly ranked with the most relevant nodes, like node 1 which directly answers the question, placed at the top, and irrelevant nodes, like node 2, are ranked lower, ensuring perfect contextual precision.",
Contextual Precision,1.0,Llama-3 70B,"The score is 1.00 because all nodes in the retrieval context are relevant to the input, and they are all ranked correctly at the top, with the first node explaining that Site Operations Center is for setup and the second node explaining that it is involved in communication, resulting in perfect contextual precision.",
Contextual Precision,1.0,Llama-3 70B,"The score is 1.00 because all irrelevant nodes are correctly ranked lower than the relevant node, which is the first node in the retrieval context. The first node directly addresses the location requirement, while the other nodes talk about different aspects of the Lunar Exploration Light Rover, such as absolute localization, self-location during construction tasks, and digital terrain mapping, which are not directly related to the expected output. Therefore, the model correctly prioritizes the relevant information and pushes the irrelevant nodes down the ranking, resulting in a perfect contextual precision score of 1.00.",
Contextual Precision,1.0,Llama-3 70B,"The score is 1.00 because all nodes in the retrieval context are relevant to the input and are ranked correctly, with the first node providing a direct answer and the second node providing related information to the Rosetta spacecraft launch, both of which are correctly ranked as the top nodes.",
Contextual Precision,0.0,Llama-3 70B,"The score is 0.00 because there are no retrieval contexts to evaluate, hence no nodes are ranked correctly or incorrectly, resulting in a score of 0.00",
Contextual Precision,1.0,Llama-3 70B,"The score is 1.00 because all nodes in the retrieval context are correctly ranked with relevant information, directly answering the question, like the first node which explains the calculations of the Ariane 5 launch vehicle performances, providing a clear and concise answer to the input question.",
Contextual Precision,1.0,Llama-3 70B,"The score is 1.00 because all nodes in the retrieval context are correctly ranked, with the first node being highly relevant to the input and the second node being irrelevant, which is exactly what we want to see in a perfect ranking scenario. The first node provides a clear answer to the question, while the second node lacks any relevant information, making it a perfect separation of relevant and irrelevant nodes in the retrieval context. This is the ideal case where all relevant nodes are ranked higher than all irrelevant nodes, resulting in a perfect contextual precision score of 1.00.",
Contextual Precision,0.0,Llama-3 70B,"The score is 0.00 because the top ranked nodes in the retrieval context are irrelevant to the input, specifically the first node which talks about ground tracking and initial communications and the second node which talks about high gain antenna and close fly-by, which are not related to the input",
Contextual Precision,1.0,Llama-3 70B,"The score is 1.00 because all the relevant nodes in the retrieval context are ranked higher than the irrelevant nodes, with the first node providing a direct answer to the input question and the second node being unrelated to the monitoring of mission critical Steady State Parameters.",
Contextual Precision,1.0,Llama-3 70B,"The score is 1.00 because the first node in the retrieval context, which directly answers the question, is ranked highest and all irrelevant nodes are correctly ranked lower, demonstrating perfect contextual precision. The irrelevant nodes, ranked 2-5, do not specifically address the question, providing a clear distinction between relevant and irrelevant information.",
Contextual Precision,1.0,Llama-3 70B,"The score is 1.00 because all the relevant nodes in the retrieval context, like the first node, are ranked higher than irrelevant nodes, as the first node explicitly mentions ",
Contextual Precision,1.0,Llama-3 70B,"The score is 1.00 because all nodes in the retrieval context are perfectly ranked, with the most relevant nodes, like node 1 and node 2, being ranked higher than the irrelevant node 3, which mentions ",
Contextual Precision,1.0,Llama-3 70B,"The score is 1.00 because all nodes in the retrieval context are ranked correctly, with both the first node and second node having a ",
Contextual Precision,1.0,Llama-3 70B,"The score is 1.00 because all nodes in the retrieval context are correctly ranked with relevant information, with the first node explicitly stating the tool",
Contextual Precision,0.0,Llama-3 70B,"The score is 0.00 because all nodes in the retrieval context are irrelevant to the input, with the first node stating that both phases are described separately without comparison, the second node focusing on describing the phases without comparing them, and the third node listing mission phases without implying any distinction. Therefore, the irrelevant nodes are ranked higher than the relevant nodes, resulting in a score of 0.00.",
Contextual Precision,1.0,Llama-3 70B,"The score is 1.00 because all the nodes in the retrieval context are relevant to the input, and they are perfectly ranked, with the most relevant node at rank 1, which explicitly states the expected output ",
Contextual Precision,1.0,Llama-3 70B,"The score is 1.00 because all nodes in the retrieval context are relevant to the input, and they are ranked correctly with the most relevant nodes at the top, starting from the first node, which has the reason ",
Contextual Precision,1.0,Llama-3 70B,"The score is 1.00 because all nodes in the retrieval context are relevant to the input, with the first node directly answering the question and providing a clear explanation, resulting in perfect ranking and a score of 1.00. This demonstrates exceptional contextual understanding and precision in ranking relevant nodes higher than irrelevant nodes, which are nonexistent in this case.",
Contextual Precision,0.7708333333333333,Llama-3 70B,"The score is 0.77 because the top-ranked nodes in the retrieval context are mostly relevant to the input, with the first, third, fourth, and sixth nodes providing strong supporting reasons for the inadequacy of a chain of evidence. However, the second and fifth nodes are ranked too high, as they provide unrelated or no relevant information to support the expected output, which prevents the score from being higher.",
Contextual Precision,1.0,Llama-3 70B,"The score is 1.00 because all nodes in the retrieval context are relevant to the input, with the first node directly addressing the question and providing the required information, making it perfectly ranked and achieving a perfect score.",
Contextual Precision,1.0,Llama-3 70B,"The score is 1.00 because all nodes in the retrieval context are correctly ranked, with each node being highly relevant to the input, addressing the design of the evidence management service infrastructure and providing requirements for it. The first node clearly addresses the design, the second node explicitly mentions the next task, and the third node provides details about the requirements, making them all highly relevant and correctly ranked at the top.",
Contextual Precision,0.0,Llama-3 70B,"The score is 0.00 because all nodes in the retrieval context are irrelevant to the input, with the first node stating ",
Contextual Precision,1.0,Llama-3 70B,"The score is 1.00 because all nodes in the retrieval context are correctly ranked, with the first node providing a clear explanation of the steps involved in the overall approach, thus ensuring perfect contextual precision.",
Contextual Precision,1.0,Llama-3 70B,"The score is 1.00 because the single node in the retrieval context is perfectly relevant to the input, as it explicitly states the exact answer to the input question, thus ranking it as the top node at rank 1, which is ideal for contextual precision. This is a perfect alignment between the input and the top-ranked node, resulting in a perfect score of 1.00. It",
Contextual Precision,1.0,Llama-3 70B,"The score is 1.00 because all nodes in the retrieval context are correctly ranked, with the first node stating that it should be possible to assign requirements to system components and the second node mentioning the possibility of having two separate development teams implementing the same system with the same functionality, making it clear that both nodes are relevant to the input question, thus achieving perfect contextual precision.",
Contextual Precision,1.0,Llama-3 70B,"The score is 1.00 because all the relevant nodes in the retrieval context, such as node 1, which mentions the RE approach, and node 2, which highlights the importance of understanding the application domain, are ranked higher than the irrelevant nodes, like node 3, which is not directly related to the approach of understanding the application domain, thus resulting in a perfect ranking order.",
Contextual Precision,1.0,Llama-3 70B,"The score is 1.00 because all nodes in the retrieval context are correctly ranked with the relevant nodes at the top, such as node 1 which clearly lists the main functional areas of the OPENCOSS platform, and the irrelevant nodes at the bottom, such as node 2 which does not provide information about the main functional areas of the OPENCOSS platform, resulting in a perfect ranking order.",
Contextual Precision,0.3333333333333333,Llama-3 70B,"The score is 0.33 because the first two nodes in the retrieval context, which are irrelevant to the input, are ranked higher than the third node, which is relevant. The first node is about propulsion system failure points and the second node is about adapting SCMSs, which are unrelated to the main problem in the design of an approach. The third node, which is relevant, highlights the lack of affordable certification approaches as a major problem.",
Contextual Precision,1.0,Llama-3 70B,"The score is 1.00 because all nodes in the retrieval context are correctly ranked as relevant, with the first node explicitly stating the zoom requirement for the rover, making it perfectly relevant to the input question.",
Contextual Precision,0.0,Llama-3 70B,"The score is 0.00 because the first node in the retrieval context, which is irrelevant to the input, is ranked the highest, preventing relevant nodes from being ranked higher, thus lowering the contextual precision score to 0.00",
Contextual Precision,1.0,Llama-3 70B,"The score is 1.00 because all the relevant nodes in the retrieval context are ranked higher than the irrelevant nodes, as the first node explicitly states the mode of control, and the lower ranked nodes are not directly related to the question of mode of control for the Lunar Exploration Light Rover, making the ranking perfect and resulting in a score of 1.00.",
Contextual Precision,1.0,Llama-3 70B,"The score is 1.00 because all nodes in the retrieval context are relevant to the input, and they are ranked perfectly with no irrelevant nodes in the retrieval context, resulting in a perfect score of 1.00",
Contextual Precision,1.0,Llama-3 70B,"The score is 1.00 because the only node in the retrieval context is a perfect match, directly mentioning the ",
Contextual Precision,1.0,Llama-3 70B,"The score is 1.00 because all retrieval context nodes are relevant to the input, with the first node directly defining the absolute pointing error, providing the exact expected output, making it a perfect ranking.",
Contextual Precision,1.0,Llama-3 70B,"The score is 1.00 because all the nodes in the retrieval context are ranked correctly with the most relevant node at rank 1, directly defining the relative pointing error, and the second node at rank 2 providing relevant context to understand the importance of relative pointing error. Therefore, the model perfectly distinguishes between relevant and irrelevant nodes, resulting in a perfect contextual precision score of 1.00",
Contextual Precision,1.0,Llama-3 70B,"The score is 1.00 because all nodes in the retrieval context are ranked correctly, with the first node being the most relevant and directly defining the absolute measurement error, making it a perfect ranking order. This means that the model has correctly identified the most important information for the input query, resulting in a perfect contextual precision score of 1.00. The model",
Contextual Precision,1.0,Llama-3 70B,"The score is 1.00 because all nodes in the retrieval context are relevant to the input, with the first node stating that the angular separation is the ",
Contextual Precision,1.0,Llama-3 70B,"The score is 1.00 because all the nodes in the retrieval context that are relevant to the input, such as node 1 and node 2, are correctly ranked higher than the irrelevant node 3, which talks about maintaining sun pointing during hibernation, rather than re-acquiring it after a certain event, ensuring perfect contextual precision.",
Contextual Precision,1.0,Llama-3 70B,"The score is 1.00 because all nodes in the retrieval context are correctly ranked as relevant, with the first node explicitly stating the answer to the input question, making it a perfect ranking.",
Contextual Precision,1.0,Llama-3 70B,"The score is 1.00 because all the nodes in the retrieval context are ranked correctly, with the first node stating that ",
Contextual Precision,0.8333333333333333,Llama-3 70B,"The score is 0.83 because the first and third nodes in the retrieval context, which are relevant to the input, are ranked higher than the second node, which is not relevant to the input. The first node is ranked first as it directly answers the question, and the third node is ranked third as it mentions ",
Contextual Precision,1.0,Llama-3 70B,"The score is 1.00 because all the nodes in the retrieval context are relevant to the input, and are ranked correctly at the top, with the first node and second node both providing strong evidence of routine functions like ",
Contextual Precision,1.0,Llama-3 70B,"The score is 1.00 because all nodes in the retrieval context are relevant, with the first node explicitly stating the near-nucleus phase",
Contextual Precision,1.0,Llama-3 70B,"The score is 1.00 because all nodes in the retrieval context are relevant to the input, and the only node is ranked first, which is perfect ranking. The node explicitly states the duration of the study, providing a direct answer to the input question, which is ideal for contextual precision.",
Contextual Precision,1.0,Llama-3 70B,"The score is 1.00 because all the nodes in the retrieval context are relevant to the input, and they are all ranked correctly, with the first node stating ",
Contextual Precision,0.5,Llama-3 70B,"The score is 0.50 because the first node in the retrieval context, which is irrelevant to the input, is ranked equally high as the second node, which is directly relevant. The first node",
Contextual Precision,0.0,Llama-3 70B,"The score is 0.00 because all nodes in the retrieval context, starting from the first node, are irrelevant to the input, as there is no context provided to arrive at the expected output of 95% confidence level in the fly-by, which should be ranked lower than relevant nodes, but there are no relevant nodes in this case, resulting in a score of 0.00",
Contextual Precision,0.3333333333333333,Llama-3 70B,"The score is 0.33 because the top 2 nodes in the retrieval context are irrelevant to the input, with the first node discussing absolute pointing error during different phases, and the second node also talking about absolute pointing error during different phases, which are not directly related to the cone angle of the payload line of sight, whereas the third node directly provides the required information, hence the score is not higher.",
Contextual Precision,1.0,Llama-3 70B,"The score is 1.00 because all nodes in the retrieval context are ranked correctly, with the first node mentioning ",
Contextual Precision,1.0,Llama-3 70B,"The score is 1.00 because all nodes in the retrieval context are relevant to the input and are ranked correctly, as seen in the first node which directly answers the question by stating that the Propulsion System shall have thermal control capability to prevent condensation of propellants outside the reach of the propellant management device (PMD) within the tanks.",
Contextual Precision,1.0,Llama-3 70B,"The score is 1.00 because all nodes in the retrieval context are relevant to the input and ranked correctly, making it a perfect match. The first node in the retrieval context is a direct match, stating ",
Contextual Precision,1.0,Llama-3 70B,"The score is 1.00 because all nodes in the retrieval context are correctly ranked, with the highly relevant node at rank 1 directly answering the question and the irrelevant node at rank 2 providing no relevant information, perfectly distinguishing between the two nodes in the retrieval context based on their relevance to the input query. The model has flawlessly executed contextual precision, ensuring the most relevant node is prioritized and presented first, making it easy for users to find the desired information quickly and efficiently.",
Contextual Precision,1.0,Llama-3 70B,"The score is 1.00 because all nodes in the retrieval context are relevant to the input and ranked correctly, with the first node explicitly stating the Contractor",
Contextual Precision,1.0,Llama-3 70B,"The score is 1.00 because all nodes in the retrieval context are relevant and ranked accordingly, with the first node providing direct assistance information, the second node explaining the Contractor",
Contextual Precision,1.0,Llama-3 70B,The score is 1.00 because all nodes in the retrieval context with ,
Contextual Precision,1.0,Llama-3 70B,"The score is 1.00 because all nodes in the retrieval context are relevant to the input, with the first node directly answering the question and the second node providing additional context related to import and export licenses, making them perfectly ranked in order of relevance.",
Contextual Precision,1.0,Llama-3 70B,"The score is 1.00 because all nodes in the retrieval context are relevant to the input, and thus ranked perfectly, with the first node stating ",
Contextual Precision,1.0,Llama-3 70B,"The score is 1.00 because all nodes in the retrieval context are relevant and correctly ranked at the top, with the first node explicitly mentioning the use of EWR procedures to support EC installations, as stated in Chapter 2, making it a perfect ranking.",
