metric,score,evaluation_model,reason,error
Contextual Precision,1.0,Llama-3 70B,"The score is 1.00 because all relevant nodes in the retrieval context, specifically the first and second nodes, are ranked higher than the irrelevant nodes, which start from the third node. The relevant nodes provide a clear definition of Government Property, whereas the irrelevant nodes discuss unrelated topics such as Government Property Management Plan and General Safety and Environmental Program Management, making them less useful in arriving at the expected output. This perfect ranking results in a score of 1.00, indicating excellent contextual precision.",
Contextual Precision,0.06666666666666667,Llama-3 70B,"The score is 0.07 because the first 15 nodes in the retrieval context, which are ranked 1 through 15, do not address the question, while the 16th node, which is the first relevant node, correctly states that ",
Contextual Precision,1.0,Llama-3 70B,"The score is 1.00 because all the irrelevant nodes in the retrieval context, starting from the 2nd node, are correctly ranked lower than the first node, which directly answers the question about what the Contractor must establish for effective and integrated security risk management. The irrelevant nodes discuss unrelated topics such as maintaining HCCS EG installed, ensuring Class Certification, reporting deviations, and protecting HCCS EG assets, which are not directly related to the question, and thus are correctly ranked lower than the relevant node. This perfect ranking results in a score of 1.00, indicating excellent contextual precision.",
Contextual Precision,0.0,Llama-3 70B,"The score is 0.00 because all nodes in the retrieval context are irrelevant to the input, with the first node being about planning and resources allocation, the second node being about reporting progress, and so on, with none of them mentioning readiness levels or priorities for work directly. As a result, all irrelevant nodes are ranked higher than relevant nodes, which is not desirable for a good contextual precision score.",
Contextual Precision,1.0,Llama-3 70B,"The score is 1.00 because all irrelevant nodes in the retrieval context, such as node 2 discussing Technical Data Disposal, node 3 discussing disposal management, and so on, are correctly ranked lower than the relevant node 1, which directly answers the question, resulting in a perfect ranking of relevant nodes above irrelevant nodes.",
Contextual Precision,1.0,Llama-3 70B,"The score is 1.00 because all the irrelevant nodes are correctly ranked lower than the relevant node at rank 1, which explicitly states the purpose of TDMIS. This perfect ranking is a testament to the model",
Contextual Precision,1.0,Llama-3 70B,"The score is 1.00 because all irrelevant nodes are correctly ranked lower than the first relevant node, which directly answers the question ",
Contextual Precision,1.0,Llama-3 70B,"The score is 1.00 because all the irrelevant nodes in the retrieval context are correctly ranked lower than the relevant node at rank 1, which directly addresses the input question and provides the expected output, as stated in the reason of the first node, ",
Contextual Precision,1.0,Llama-3 70B,"The score is 1.00 because all the relevant nodes are ranked higher than the irrelevant nodes. The first two nodes in the retrieval context are relevant and correctly ranked, while the rest of the nodes are irrelevant and correctly placed at the bottom of the ranking list. This perfect ranking is the reason for the perfect score of 1.00",
Contextual Precision,0.0,Llama-3 70B,"The score is 0.00 because all nodes in the retrieval context are irrelevant to the input question, with the first node stating ",
Contextual Precision,0.08333333333333333,Llama-3 70B,"The score is 0.08 because the first 12 nodes in the retrieval context are irrelevant to the input, with reasons such as ",
Contextual Precision,0.0,Llama-3 70B,"The score is 0.00 because there is only one node in the retrieval context, and it is an irrelevant node, ranked 1st, with a reason that it does not directly mention the launch date as January 2003, which makes it impossible to achieve a higher score given the current ranking of nodes in the retrieval context.",
Contextual Precision,1.0,Llama-3 70B,"The score is 1.00 because all relevant nodes, like the first node, are correctly ranked higher than irrelevant nodes, which lack information about Earth swing-bys, as seen in nodes 2 through 20, resulting in perfect contextual precision.",
Contextual Precision,0.0,Llama-3 70B,"The score is 0.00 because all the nodes in the retrieval context are irrelevant to the input, with each of the first 20 nodes being ranked as irrelevant, stating ",
Contextual Precision,1.0,Llama-3 70B,"The score is 1.00 because all irrelevant nodes in the retrieval context, ranked 2-20, have ",
Contextual Precision,1.0,Llama-3 70B,The score is 1.00 because all the nodes in the retrieval context that are relevant to the input question about the subsystem,
Contextual Precision,1.0,Llama-3 70B,"The score is 1.00 because all the irrelevant nodes are correctly ranked lower than the relevant node at rank 1, which clearly states that the main actuator for orbit around the comet nucleus is reaction wheels, directly answering the question. The rest of the nodes do not address the question, talking about different aspects of the spacecraft and comet observation, and are correctly placed at lower ranks. The model",
Contextual Precision,0.08333333333333333,Llama-3 70B,"The score is 0.08 because all irrelevant nodes, from the 1st node to the 11th node, were ranked higher than the relevant node at the 12th rank, indicating that the model is not effective in distinguishing between relevant and irrelevant information. The relevant node at the 12th rank has a reason stating that ESOC FD provides a model of the comet nucleus, which should have been ranked higher than the irrelevant nodes with reasons not related to ESOC FD and the comet nucleus model.",
Contextual Precision,1.0,Llama-3 70B,"The score is 1.00 because all the irrelevant nodes in the retrieval context, such as nodes 2-10, are correctly ranked lower than the relevant node 1, which directly states that ",
Contextual Precision,1.0,Llama-3 70B,"The score is 1.00 because all the irrelevant nodes in the retrieval context are correctly ranked lower than the relevant node, with the first node being the most relevant, as it explicitly states that ",
Contextual Precision,1.0,Llama-3 70B,"The score is 1.00 because all the relevant nodes in the retrieval context, like the first node, are correctly ranked higher than the irrelevant nodes, like the second, third, fourth, and fifth nodes, as they directly answer the question or are not related to the topic of backshield of a silicon solar cell, respectively. This perfect ranking results in a perfect score of 1.00.",
