metric,score,evaluation_model,reason,error
Contextual Precision,1.0,Llama-3 70B,"The score is 1.00 because the only relevant node in the retrieval context, ranked 1, explicitly states who will assign the AMCS number, while all the irrelevant nodes, ranked 2-20, do not provide any information about the assignment of the AMSC number, thus they are correctly ranked lower than the relevant node.",
Contextual Precision,0.5,Llama-3 70B,"The score is 0.50 because the first node in the retrieval context is irrelevant to the input, providing a general description of a data item, whereas the second node provides the relevant information about the approval date, and thus should be ranked higher.",
Contextual Precision,1.0,Llama-3 70B,"The score is 1.00 because all the relevant nodes, like the first node in the retrieval context, are correctly ranked higher than the irrelevant nodes, which are all the other nodes in the retrieval context, because they clearly do not discuss DID numbers being referenced under ",
Contextual Precision,0.7155328798185941,Llama-3 70B,"The score is 0.72 because the model successfully ranked relevant nodes higher than irrelevant nodes, with the top-ranked node mentioning ",
Contextual Precision,0.0,Llama-3 70B,"The score is 0.00 because all nodes in the retrieval context are irrelevant to the input, with the first node stating ",
Contextual Precision,1.0,Llama-3 70B,"The score is 1.00 because all relevant nodes in the retrieval context are ranked higher than irrelevant nodes. The first six nodes, ranked 1 to 6, are all ",
Contextual Precision,0.0,Llama-3 70B,"The score is 0.00 because all the top ranked nodes in the retrieval context are irrelevant, with the first node being a table of contents, the second node discussing collecting and evaluating evidence, the third node being an image, and the fourth node being a footer, none of which provide information about the steps involved in the overall approach, resulting in a complete mismatch between the input and the top ranked nodes in the retrieval context, hence the score is 0.00",
Contextual Precision,0.75,Llama-3 70B,"The score is 0.75 because the top 2 nodes in the retrieval context are relevant to the input, and the next 2 nodes are irrelevant, which is why the score is not higher. The irrelevant nodes, ranked 3 and 4, have reasons ",
Contextual Precision,0.8333333333333333,Llama-3 70B,"The score is 0.83 because the first two nodes in the retrieval context, which are ranked as the most relevant, correctly identify the function level and its correspondence, but the following nodes, starting from the third node, are irrelevant and should be ranked lower. For instance, the third node is about RAM action steps and does not provide any information about the function level or what it corresponds to, and similarly, the subsequent nodes do not address the input query. If these irrelevant nodes were ranked lower, the score would be higher.",
Contextual Precision,1.0,Llama-3 70B,"The score is 1.00 because all the relevant nodes in the retrieval context, such as nodes ranked 1 and 2, directly address the question about the flaws found in function level requirements, while all the irrelevant nodes are correctly ranked lower, starting from node 3, which do not directly relate to the question about flaws in function level requirements, thus resulting in a perfect ranking order and achieving a score of 1.00.",
Contextual Precision,1.0,Llama-3 70B,"The score is 1.00 because all the irrelevant nodes, starting from the second node, are correctly ranked lower than the first node which explicitly states the aim of the survey, providing a clear and direct answer to the question. The model perfectly distinguishes between relevant and irrelevant information, resulting in a perfect contextual precision score.",
Contextual Precision,1.0,Llama-3 70B,"The score is 1.00 because all relevant nodes in the retrieval context are correctly ranked higher than the irrelevant nodes. The top 2 nodes directly address the question about component level, while the rest of the nodes are not directly relevant and are correctly ranked lower, starting from the 3rd node onwards. This perfect ranking results in a perfect score of 1.00, indicating that the model is able to accurately distinguish between relevant and irrelevant information, which is fantastic!",
Contextual Precision,1.0,Llama-3 70B,"The score is 1.00 because all the irrelevant nodes in the retrieval context, such as node 2, node 3, node 4, node 5, node 6, node 7, node 8, node 9, node 10, are correctly ranked lower than the relevant node 1, which clearly defines a business process as ",
Contextual Precision,1.0,Llama-3 70B,"The score is 1.00 because all the relevant nodes in the retrieval context, such as node 1, node 2, node 3, node 4, node 5, node 6, node 7, and node 8, which directly relate to the use cases of the OPENCOSS platform, are ranked higher than the irrelevant nodes, such as node 9, node 10, node 11, node 12, node 13, node 14, node 15, node 16, and node 17, which do not directly relate to the use cases of the OPENCOSS platform. The ranking is perfect, with all the relevant nodes at the top and all the irrelevant nodes at the bottom, resulting in a perfect contextual precision score of 1.00.",
Contextual Precision,0.44047619047619047,Llama-3 70B,"The score is 0.44 because the irrelevant nodes, like node 1 and node 2, are ranked higher than some relevant nodes, but the relevant nodes, like node 3 and node 5, are ranked higher than most irrelevant nodes, which indicates that the model is somewhat effective in distinguishing between relevant and irrelevant nodes, but there is still room for improvement to prioritize relevant nodes more highly. The irrelevant nodes, like node 6 and node 7, are correctly ranked lower than most relevant nodes, but the model could still do better in prioritizing the most relevant nodes, like node 3 and node 5, even higher.",
Contextual Precision,1.0,Llama-3 70B,"The score is 1.00 because all the irrelevant nodes in the retrieval context, starting from the 2nd node, are correctly ranked lower than the highly relevant 1st node, which directly answers the question, as stated in its reason ",
Contextual Precision,0.3333333333333333,Llama-3 70B,"The score is 0.33 because the model ranks irrelevant nodes, such as node 1 and node 2, higher than relevant nodes, like node 3. Node 1 and node 2 do not mention the Lunar Exploration Light Rover or its capabilities, as stated in their reasons, and should be ranked lower than node 3, which explicitly mentions the Lunar Exploration Light Rover and its High Manoeuvrability Options. The model should prioritize nodes that directly provide information about the capabilities over nodes that do not mention the Lunar Exploration Light Rover or its capabilities, but it fails to do so, resulting in a lower score.",
Contextual Precision,1.0,Llama-3 70B,"The score is 1.00 because all irrelevant nodes were correctly ranked lower than the relevant node at rank 1, which directly addresses the question of how the Lunar Exploration Light Rover supports on-board crew navigation by providing digital terrain maps and localization aids. The irrelevant nodes, such as the Driving Console, Camera display, and others, do not directly address the question and are therefore correctly ranked lower, resulting in a perfect score of 1.00.",
Contextual Precision,1.0,Llama-3 70B,"The score is 1.00 because all the irrelevant nodes in the retrieval context are correctly ranked lower than the relevant node at rank 1, which is the only ",
Contextual Precision,1.0,Llama-3 70B,"The score is 1.00 because all the irrelevant nodes in the retrieval context are correctly ranked lower than the relevant node at rank 1, which provides the correct answer",
Contextual Precision,1.0,Llama-3 70B,"The score is 1.00 because all relevant nodes in the retrieval context are ranked higher than the irrelevant nodes. For instance, the first node directly answers the question about the rollover threshold of the Lunar Exploration Light Rover, whereas the subsequent nodes discuss unrelated topics like angle of approach, driveline configuration, high manoeuvrability options, and rationale for various requirements, which are ranked lower accordingly. This perfect ranking is reflected in the score of 1.00, indicating that the model is able to effectively differentiate between relevant and irrelevant information in this context.",
Contextual Precision,1.0,Llama-3 70B,"The score is 1.00 because all the irrelevant nodes, from the second node onwards, are correctly ranked lower than the first node which directly answers the question about the Lunar Exploration Light Rover",
Contextual Precision,0.0,Llama-3 70B,"The score is 0.00 because all nodes in the retrieval context are ranked as irrelevant, with reasons such as ",
Contextual Precision,1.0,Llama-3 70B,"The score is 1.00 because all irrelevant nodes in the retrieval context are correctly ranked lower than the first relevant node, which is ranked 1, and provides a direct answer to the input question with a clear explanation of how the percentage can be calculated from the given accuracy and range values, resulting in a perfect ranking of relevant and irrelevant nodes.",
Contextual Precision,0.0,Llama-3 70B,"The score is 0.00 because all the nodes in the retrieval context are ranked as irrelevant, with reasons like ",
Contextual Precision,0.16666666666666666,Llama-3 70B,"The score is 0.17 because the model ranks 5 out of 7 irrelevant nodes in the top 5 ranks, with the first node being a document header or metadata section, the second node being about I-BOB and EGSE requirements, the third node being about the spacecraft EQM and its testing, the fourth node being about the delivery of a simulator to ESOC, and the fifth node being about system level functional tests. The model only ranks the relevant node at rank 6, which defines pointing related terms, including Relative Pointing Error (RPE) which is also known as pointing stability.",
Contextual Precision,0.25,Llama-3 70B,"The score is 0.25 because the relevant node at rank 4 is correctly ranked higher than many irrelevant nodes, but many other irrelevant nodes at ranks 1-3, 5-20 are ranked higher than the relevant node, which should be ranked lower due to their reasons, such as ",
Contextual Precision,0.24285714285714285,Llama-3 70B,"The score is 0.24 because there are many irrelevant nodes in the retrieval context, such as nodes 1, 2, 3, 4, 6, 7, 8, 9, 10, 11, 12, and 13, which are ranked higher than relevant nodes, like node 5 and 7. The irrelevant nodes have reasons like ",
Contextual Precision,1.0,Llama-3 70B,"The score is 1.00 because all the irrelevant nodes in the retrieval context, such as node 2 talking about the independence of critical and routine functions, node 3 discussing spacecraft control and autonomous control, and so on, are correctly ranked lower than the relevant node 1 that directly addresses the input by stating ",
Contextual Precision,1.0,Llama-3 70B,"The score is 1.00 because all irrelevant nodes in the retrieval context are correctly ranked lower than the relevant node, which is ranked first. The first node provides a clear and specific requirement for the comet nucleus observation phase, whereas nodes 2-6 discuss unrelated topics such as relative roll pointing error, asteroid fly-by phase, comet nucleus orbiting, reliability and fault tolerance, and material from comets, respectively, which are not relevant to the input question.",
Contextual Precision,0.3206349206349206,Llama-3 70B,"The score is 0.32 because the model ranks irrelevant nodes higher than relevant nodes. For example, the 1st node is not directly related to Wake up functionality and restoring maximum rate communications channel, but it is ranked higher than the 5th node which is directly related to the topic. Similarly, the 8th node is not directly related to the topic, but it is ranked higher than the 6th node which is directly related to Wake up functionality and restoring maximum rate communications channel. This indicates that the model is not effectively distinguishing between relevant and irrelevant nodes, leading to a lower contextual precision score.",
Contextual Precision,0.5,Llama-3 70B,"The score is 0.50 because the relevant node at rank 2 is correctly ranked higher than the irrelevant nodes at ranks 1 and 3-10, but the model could improve by further distinguishing the irrelevant nodes, as nodes at ranks 3-10 provide no information about the launch date of the Interational Rosetta Mission, whereas the node at rank 1 mentions a related but distinct mission, ROSETTA, which might be more relevant than the other irrelevant nodes.",
Contextual Precision,1.0,Llama-3 70B,"The score is 1.00 because all the nodes in the retrieval context are relevant to the input, and are correctly ranked at the top, as they provide direct information about the International Rosetta Mission, with the first node explicitly stating its approval and mission details, thus making it a perfect ranking with no irrelevant nodes present.",
Contextual Precision,1.0,Llama-3 70B,"The score is 1.00 because all the irrelevant nodes in the retrieval context, starting from the second node, are correctly ranked lower than the first node which is relevant to the input, with reasons such as ",
Contextual Precision,0.5,Llama-3 70B,"The score is 0.50 because the first node in the retrieval context is an irrelevant node, which should be ranked lower than the second node which is relevant, providing detailed information about the Rosetta mission",
Contextual Precision,0.0,Llama-3 70B,"The score is 0.00 because all the nodes in the retrieval context are irrelevant to the input, with the first node stating ",
Contextual Precision,1.0,Llama-3 70B,"The score is 1.00 because all irrelevant nodes in the retrieval context are correctly ranked lower than the relevant node, which is the first node providing the definition of Yield Loads. This is perfect ranking, as all the other nodes are not directly related to the question about Yield Loads, with reasons including talking about Ultimate Loads, Buckling Loads, Design Loads, interfaces, Preliminary Design Loads, and tables and values for Design Loads, making them less relevant than the first node.",
Contextual Precision,1.0,Llama-3 70B,"The score is 1.00 because all relevant nodes in the retrieval context, like node 1, are correctly ranked higher than irrelevant nodes, like nodes 2-6, due to their direct relation to static analysis of software code and providing clear explanations, such as ",
Contextual Precision,1.0,Llama-3 70B,"The score is 1.00 because all the relevant nodes in the retrieval context, such as node 1 and node 2, are correctly ranked higher than the irrelevant nodes, like node 3 and node 4, which are unrelated to the topic of asteroids, comets, and planetesimals in the solar nebula, and do not contribute to the understanding of their relationship or the formation of our Solar System. The model is doing a perfect job of distinguishing between relevant and irrelevant information, which is fantastic!",
Contextual Precision,1.0,Llama-3 70B,"The score is 1.00 because the only relevant node in the retrieval context, ranked 1st, directly addresses the question, while all the irrelevant nodes are correctly ranked lower, from 2nd onwards, as they are not relevant to the question.",
Contextual Precision,0.09090909090909091,Llama-3 70B,"The score is 0.09 because the irrelevant nodes in the retrieval context, such as the 1st, 2nd, 3rd, 4th, 5th, 6th, 7th, 8th, 9th, and 11th nodes, are ranked higher than the relevant node, the 10th node, which specifically addresses the ",
Contextual Precision,0.07142857142857142,Llama-3 70B,"The score is 0.07 because the irrelevant nodes, like the 1st node, the 2nd node, the 3rd node, and so on, are ranked higher than the relevant node, the 16th node, which states ",
Contextual Precision,0.5666666666666667,Llama-3 70B,"The score is 0.57 because the first relevant node in the retrieval context is ranked first, but then there are several irrelevant nodes (rank 2-9) that should be ranked lower, such as nodes discussing document information, radio frequency tracking techniques, and comet model parameters, which do not directly relate to Major orbit manoeuvres function. However, there are other relevant nodes (rank 16) that are correctly ranked higher than the irrelevant nodes, which contributes to the score being above 0.5. Overall, the model is doing a decent job of distinguishing between relevant and irrelevant nodes, but there is still room for improvement to rank the irrelevant nodes even lower.",
Contextual Precision,1.0,Llama-3 70B,"The score is 1.00 because all the irrelevant nodes in the retrieval contexts are correctly ranked lower than the relevant node at rank 1, which explicitly mentions the required information about the comet nucleus observation phase and confidence levels, thus achieving a perfect contextual precision score.",
Contextual Precision,0.0,Llama-3 70B,"The score is 0.00 because all the nodes in the retrieval context are irrelevant to the input question, with the top-ranked nodes (1-15) being focused on the Lunar Exploration Light Rover",
Contextual Precision,1.0,Llama-3 70B,"The score is 1.00 because all the irrelevant nodes in the retrieval context, such as node 2, node 3, node 4, node 5, and node 6, are correctly ranked lower than the relevant node at rank 1, which clearly addresses the question about Rosetta. The model successfully distinguished between relevant and irrelevant information, resulting in a perfect score.",
Contextual Precision,1.0,Llama-3 70B,The score is 1.00 because all the irrelevant nodes in the retrieval contexts are correctly ranked lower than the first node which directly answers the input question. The first node,
Contextual Precision,0.0,Llama-3 70B,"The score is 0.00 because there is no relevant retrieval context provided, hence no ranking can be done to determine precision. In this case, there are no nodes in the retrieval context to rank or evaluate, leading to a score of 0.00. This score is not higher because there is no relevant information to work with, resulting in no precision to measure or evaluate. The score is not lower because there is no opportunity for irrelevant nodes to be ranked higher than relevant nodes, as there are no nodes at all in the retrieval context to evaluate or rank. In essence, there is no retrieval context to work with, resulting in a score of 0.00, which is the lowest possible score in this scenario.",
Contextual Precision,0.2,Llama-3 70B,"The score is 0.20 because the relevant node at rank 5 is correctly ranked higher than the irrelevant nodes at ranks 1, 2, 3, 4, 6, 7, and 8, but the irrelevant nodes should be ranked lower than the relevant node, as they do not directly relate to the question about what the contractor must count, whereas the relevant node explicitly answers the question. The model can improve by ranking the irrelevant nodes even lower and prioritizing the relevant node further up the list.",
Contextual Precision,0.0625,Llama-3 70B,"The score is 0.06 because the top-ranked nodes in the retrieval context, such as nodes 1-19, are irrelevant to the input, mentioning other maintenance activities and plans, whereas the relevant node, ranked 20, clearly addresses the question by stating that ",
Contextual Precision,0.0,Llama-3 70B,"The score is 0.00 because there is only one node in the retrieval context and it is irrelevant to the input, hence no ranking can be made. The first node is not relevant to the input as there is no context provided, hence no verdict can be made, making it impossible to rank relevant nodes higher than irrelevant nodes.",
Contextual Precision,0.08333333333333333,Llama-3 70B,"The score is 0.08 because the model is not effectively ranking relevant nodes higher than irrelevant nodes. The first 19 nodes in the retrieval context are all irrelevant, with reasons such as ",
Contextual Precision,0.0,Llama-3 70B,"The score is 0.00 because all the nodes in the retrieval context are irrelevant to the input, with the first node stating that ",
Contextual Precision,0.0,Llama-3 70B,"The score is 0.00 because all nodes in the retrieval context are irrelevant to the input, with the first node stating ",
Contextual Precision,1.0,Llama-3 70B,"The score is 1.00 because all the irrelevant nodes are correctly ranked lower than the relevant node at rank 1, which directly answers the question about supporting performance indicators using the Contractor Held Inventory report, and the irrelevant nodes are correctly distinguished from the relevant one, as evident from the reasons provided for each node, ranging from rank 2 to 20, which are not related to the question about supporting performance indicators using the Contractor Held Inventory report, and thus the model is able to perfectly distinguish between relevant and irrelevant nodes, resulting in a perfect score of 1.00.",
Contextual Precision,1.0,Llama-3 70B,"The score is 1.00 because all irrelevant nodes in the retrieval context are correctly ranked lower than the relevant node at rank 1, which clearly states that ",
Contextual Precision,1.0,Llama-3 70B,"The score is 1.00 because all the irrelevant nodes in the retrieval context, such as nodes 2, 3, 4, 5, and 6, are correctly ranked lower than the relevant node at rank 1, as per their corresponding reasons, resulting in a perfect ranking of relevant nodes above irrelevant nodes.",
Contextual Precision,0.0,Llama-3 70B,"The score is 0.00 because all the nodes in the retrieval context are ranked as irrelevant, with the first node stating ",
Contextual Precision,1.0,Llama-3 70B,"The score is 1.00 because all irrelevant nodes in the retrieval context, such as nodes ranked 2 through 20, have reasons that state ",
Contextual Precision,0.0,Llama-3 70B,"The score is 0.00 because all nodes in the retrieval context are irrelevant to the input, with the first node stating ",
Contextual Precision,0.0,Llama-3 70B,"The score is 0.00 because there are no retrieval contexts provided, hence it is impossible to determine the relevance of nodes in the retrieval context to the input query, resulting in a precision score of 0.00",
Contextual Precision,0.14285714285714285,Llama-3 70B,"The score is 0.14 because the irrelevant nodes, like nodes 1-5 and 8-10, are ranked higher than the relevant node at rank 7, which directly addresses the question, stating that ",
Contextual Precision,0.0,Llama-3 70B,"The score is 0.00 because all nodes in the retrieval context, starting from the first node, are irrelevant to the input, as they do not mention security arrangements, partnerships, and alliances, and therefore should be ranked lower than relevant nodes, which are nonexistent in this case, resulting in a precision score of 0.00",
Contextual Precision,1.0,Llama-3 70B,"The score is 1.00 because all relevant nodes, like the first node, are correctly ranked higher than irrelevant nodes, which are correctly placed at lower ranks, such as nodes 2-12, as they do not address the question and provide unrelated information, like ",
Contextual Precision,0.0,Llama-3 70B,"The score is 0.00 because all the nodes in the retrieval context are irrelevant to the input, with the first node not mentioning validation by DND and the Contractor, the second node defining content, topic, and element which constitutes the data product, and so on, ranking them higher than relevant nodes would not make sense in this context, hence the score is 0.00",
Contextual Precision,0.0,Llama-3 70B,"The score is 0.00 because there are no retrieval contexts provided, so there is no ranking to evaluate for contextual precision score. As a result, the score is 0.00, which is the lowest possible score, indicating that the model failed to rank relevant nodes higher than irrelevant nodes in the retrieval contexts, which in this case, is empty. Therefore, there is no opportunity to evaluate the ranking of relevant nodes versus irrelevant nodes, resulting in a score of 0.00. The model did not have a chance to show its capabilities in ranking relevant nodes higher than irrelevant nodes, which is reflected in the score of 0.00, the lowest possible score.",
Contextual Precision,0.0,Llama-3 70B,"The score is 0.00 because all nodes in the retrieval context are irrelevant, with the first node stating ",
Contextual Precision,1.0,Llama-3 70B,The score is 1.00 because all the nodes in the retrieval context with a ,
Contextual Precision,1.0,Llama-3 70B,"The score is 1.00 because all irrelevant nodes in the retrieval context, ranked 2-20, do not provide any relevant information related to the purpose of Performance Assessment, whereas the first node directly addresses the question and provides the correct purpose, thus achieving perfect contextual precision.",
Contextual Precision,1.0,Llama-3 70B,"The score is 1.00 because the model perfectly ranked the relevant node at rank 1, and all irrelevant nodes were correctly placed below it, resulting in a flawless contextual precision score. Kudos to the model for a job well done!",
Contextual Precision,1.0,Llama-3 70B,"The score is 1.00 because all the relevant nodes in the retrieval context, such as node 1, are ranked higher than the irrelevant nodes, which ensures the highest contextual precision score possible. The irrelevant nodes, starting from node 2, do not directly relate to the expected output and thus are correctly ranked lower than the relevant nodes. This perfect ranking results in a score of 1.00, indicating that the model is performing flawlessly in this context.",
