metric,score,evaluation_model,reason,error
Contextual Precision,0.5,Llama-3 70B,"The score is 0.50 because there are irrelevant nodes, such as the 1st node discussing smooth transition, and the 4th node talking about modifications during the development process of a system, which are ranked relatively high, while the relevant node is ranked 2nd. This indicates that the model is not consistently ranking relevant nodes higher than irrelevant ones, resulting in a moderate score.",
Contextual Precision,1.0,Llama-3 70B,"The score is 1.00 because all the irrelevant nodes are correctly ranked lower than the single relevant node, which is the first node that directly answers the question about the Lunar Exploration Light Rover",
Contextual Precision,0.8055555555555555,Llama-3 70B,"The score is 0.81 because the model successfully ranks most relevant nodes higher than irrelevant nodes, but fails to distinguish between the second and third ranked nodes, which have similar relevance to the Tele-Operation mode. For instance, the first node is ranked correctly as it directly addresses the Tele-Operation mode, whereas the fifth and sixth nodes are correctly ranked lower as they do not directly address the mode. However, the model could improve by better distinguishing between the second and third nodes, which have different levels of relevance to the mode. The second node has a ",
Contextual Precision,0.25,Llama-3 70B,"The score is 0.25 because the irrelevant nodes in the retrieval context, such as the 1st node about the document revision and date, the 2nd node about the Lunar Exploration Light Rover, and the 3rd node about low-friction surfaces, are ranked higher than the relevant nodes, like the 4th node that addresses the question about the 11 degree difference providing some soil strength margin to support the vehicle. The model should prioritize the relevant nodes over the irrelevant ones to achieve a higher score.",
Contextual Precision,1.0,Llama-3 70B,"The score is 1.00 because all the irrelevant nodes in the retrieval context, such as the 2nd node about Angle of Approach, the 3rd node about Angle of Departure, the 4th node about Rollover Threshold, the 5th node about Driveline Configuration, the 6th node about Power modes, the 7th node about Smooth transition, the 8th node about Turning, and the 9th node about High Manoeuvrability Options, are correctly ranked lower than the 1st node, which directly answers the input question with the required information, thus achieving a perfect contextual precision score.",
Contextual Precision,0.5,Llama-3 70B,"The score is 0.50 because the first and fourth ranked nodes in the retrieval context are irrelevant nodes, ranked higher than the second node which directly addresses the question, and the third and fifth nodes are also irrelevant nodes, ranked lower than the second node. The second node is correctly ranked higher than the irrelevant nodes, but the other irrelevant nodes are not correctly ranked lower than the relevant node, resulting in a score of 0.50. The score is not higher because the irrelevant nodes are not correctly ranked lower than the relevant node, but it is at its current score because the relevant node is correctly ranked higher than some of the irrelevant nodes.",
Contextual Precision,1.0,Llama-3 70B,"The score is 1.00 because all irrelevant nodes in the retrieval context are correctly ranked lower than the relevant node at rank 1, which has a clear and concise reason ",
Contextual Precision,1.0,Llama-3 70B,"The score is 1.00 because all the irrelevant nodes in the retrieval context, starting from rank 2, are correctly ranked lower than the relevant node at rank 1, which clearly states the rover",
Contextual Precision,0.0,Llama-3 70B,"The score is 0.00 because there are no nodes in the retrieval context that are relevant to the input, with the first node being an irrelevant node due to ",
Contextual Precision,0.5,Llama-3 70B,"The score is 0.50 because the relevant node at rank 2 is correctly ranked higher than the irrelevant nodes at ranks 1, 3-15, which are not related to the capability of thrusters to provide pure torques about three orthogonal axes, as stated in their respective reasons, such as ",
Contextual Precision,0.0,Llama-3 70B,"The score is 0.00 because all the nodes in the retrieval context, including the first node, second node, and so on, are irrelevant to the input, as they all state ",
Contextual Precision,1.0,Llama-3 70B,"The score is 1.00 because all irrelevant nodes in the retrieval context, such as nodes ranked 2 to 9, do not provide any information about the minimisation of perturbation forces in the weak gravity field of the comet related to the input question, and are correctly ranked lower than the relevant node ranked 1, which directly answers the question by stating ",
Contextual Precision,1.0,Llama-3 70B,"The score is 1.00 because all the irrelevant nodes in the retrieval context are correctly ranked lower than the first node, which provides a direct answer to the question, mentioning that the spacecraft shall ensure communications with the Earth throughout the manoeuvre in MISS-011. This perfect ranking is a testament to the model",
Contextual Precision,0.3333333333333333,Llama-3 70B,"The score is 0.33 because the relevant node at rank 3 is ranked higher than the irrelevant nodes at ranks 1 and 2, but the irrelevant nodes at ranks 4, 5, 6, 7, 8, and 9 are ranked higher than the relevant node at rank 3, which should be ranked lower. For example, the node at rank 2 is about the mechanism featuring an unambiguous feedback control technique, which is not directly related to the monitoring of Steady State Parameters, and should be ranked lower than the relevant node at rank 3. Similarly, the node at rank 5 is about stiffness requirements and does not provide any information about monitoring Steady State Parameters, and should be ranked lower than the relevant node at rank 3.",
Contextual Precision,0.4909090909090909,Llama-3 70B,"The score is 0.49 because the model ranks irrelevant nodes at ranks 2-7, which do not provide any information related to failure tolerance and protection circuitry, higher than relevant nodes. The model should rank nodes like rank 1, which directly addresses the question, and ranks 10 and 11, which provide information related to failure tolerance and protection circuitry, higher than the irrelevant nodes. The model",
Contextual Precision,1.0,Llama-3 70B,"The score is 1.00 because all the nodes in the retrieval context are relevant to the input, with each node providing a specific detail about minimizing thruster usage, and are ranked accordingly. The first node explains the context for thrusters arrangement, the second node mentions",
Contextual Precision,0.22916666666666666,Llama-3 70B,"The score is 0.23 because the model ranks irrelevant nodes, such as nodes 1 and 2, higher than relevant nodes like node 3, which mentions Otawara and Siwa asteroids. The model should rank the relevant nodes higher than the irrelevant nodes to increase the contextual precision score. The model also fails to distinguish between the relevant nodes and the irrelevant nodes, as seen in nodes 3 and 4, where node 4 does not mention anything about the spacecraft passing close to asteroids on its journey to the comet, but is still ranked higher than node 3, which provides the correct information. Overall, the model needs to improve its ranking of relevant nodes to increase the contextual precision score.",
Contextual Precision,1.0,Llama-3 70B,"The score is 1.00 because all relevant nodes, such as the first node describing the navigation camera providing positional data and the second node about producing a model of the nucleus shape, are ranked higher than the irrelevant nodes, which have reasons stating ",
Contextual Precision,0.6428571428571428,Llama-3 70B,"The score is 0.64 because the top ranked nodes in the retrieval context are mostly relevant, but there are some irrelevant nodes ranked higher than relevant nodes, such as the 2nd, 3rd, 4th, 5th, 8th, 9th, and 10th nodes, which have reasons like ",
Contextual Precision,0.125,Llama-3 70B,"The score is 0.12 because the irrelevant nodes, ranked 1 to 7, do not provide any information about the distinction between orbital manoeuvres in the interplanetary phase and orbit manoeuvres during the near comet phase, whereas the relevant node, ranked 8, directly answers the question with the statement ",
Contextual Precision,1.0,Llama-3 70B,"The score is 1.00 because all the irrelevant nodes, such as node 2 discussing ",
Contextual Precision,1.0,Llama-3 70B,"The score is 1.00 because all irrelevant nodes in the retrieval context, starting from the 2nd node, were correctly ranked lower than the first node which directly addresses the input question, stating that ",
Contextual Precision,0.0,Llama-3 70B,"The score is 0.00 because all the nodes in the retrieval context are irrelevant to the input, with each of the top 20 nodes failing to mention ",
Contextual Precision,1.0,Llama-3 70B,"The score is 1.00 because all the nodes in the retrieval context that are directly relevant to the input question, such as nodes ranked 1, 2, 3, 4, and 5, are ranked higher than the irrelevant nodes, such as nodes ranked 6, 7, 8, and 9, which do not directly address the input question ",
Contextual Precision,0.25,Llama-3 70B,"The score is 0.25 because the irrelevant nodes, such as the first node discussing component level requirements, the second node about user interface mock-ups, the third node about general aspects and practices of OPENCOSS partners, and the fifth node about detailed, concrete, domain-specific requirements, are ranked relatively high, with the first three nodes being the top three nodes. The relevant node, the fourth node about propagating change information, is ranked lower at fourth position, which affects the overall precision score.",
Contextual Precision,1.0,Llama-3 70B,"The score is 1.00 because all nodes in the retrieval context are relevant to the input question, providing direct answers or closely related information, and are thus ranked correctly with no irrelevant nodes present, resulting in a perfect score.",
Contextual Precision,0.0,Llama-3 70B,"The score is 0.00 because all nodes in the retrieval context are irrelevant to the input, with the first node stating ",
Contextual Precision,0.0,Llama-3 70B,"The score is 0.00 because all nodes in the retrieval context, including the 1st, 2nd, 3rd, 4th, 5th, 6th, 7th, and 8th ranked nodes, are irrelevant to the input, as they are all table of contents for a report or document and don",
Contextual Precision,1.0,Llama-3 70B,"The score is 1.00 because the only relevant node at rank 1 directly addresses the question, and all irrelevant nodes are correctly ranked lower, with their reasons explicitly stating they do not provide any information about who is responsible for managing evidence for demonstrating compliance of critical computer-based systems with safety standards, making the ranking perfect and precise.",
Contextual Precision,1.0,Llama-3 70B,"The score is 1.00 because all the relevant nodes in the retrieval context, such as the first node, are correctly ranked higher than the irrelevant nodes, which are ranked lower. The irrelevant nodes, such as the second node, third node, and so on, are correctly placed lower in the ranking due to their reasons being unrelated to the topic of having two systems with the same functionality, such as Figure 12, FP7 project details, Document No. and Issue/Rev. No., SWRE-245, SWRE-255, Software Test During Development, SWRE-270, SWRE-275, Static Analysis, SWRE-290, and SWRE-295, not being directly related to the question of having two systems with the same functionality.",
Contextual Precision,1.0,Llama-3 70B,"The score is 1.00 because all relevant nodes in the retrieval context are ranked higher than irrelevant nodes, with the first node providing a clear explanation of the approach to understanding the application domain, while the lower-ranked nodes are not related to the approach, as stated in their respective reasons, ",
Contextual Precision,1.0,Llama-3 70B,"The score is 1.00 because all relevant nodes in the retrieval context are ranked higher than the irrelevant nodes, with the first node directly addressing the input question about the main functional areas of the OPENCOSS platform, and all subsequent nodes being irrelevant to the question, thus achieving a perfect ranking.",
Contextual Precision,0.0,Llama-3 70B,"The score is 0.00 because all the nodes in the retrieval context are irrelevant to the input question, with the first node talking about soil and lunar exploration, the second node discussing technical details, the third node explaining speed requirements, the fourth node talking about evidence management, and the fifth node discussing governance, none of which are related to the question about system analysts and IS development. As a result, the contextual precision is zero, indicating that none of the top-ranked nodes are relevant to the input question.",
Contextual Precision,1.0,Llama-3 70B,The score is 1.00 because all the nodes in the retrieval context with a ,
Contextual Precision,0.3333333333333333,Llama-3 70B,"The score is 0.33 because the relevant node, ranked 3, correctly addresses the question of where the Lunar Exploration Light Rover should be located, but most of the top-ranked nodes, such as nodes 1 and 2, do not directly address the question and instead discuss its capabilities and requirements, leading to a lower score. The irrelevant nodes should be ranked lower than the relevant one, but they are not in this case, which brings down the score.",
Contextual Precision,1.0,Llama-3 70B,"The score is 1.00 because all the relevant nodes in the retrieval context, such as the first node, are ranked higher than the irrelevant nodes, which directly answers the input question about the mode of control the Lunar Exploration Light Rover should have, and the irrelevant nodes are correctly ranked lower, as they do not directly answer the input question, like the second node talking about the Rationale for the Tele-Operated mode, and the rest of the nodes that do not directly answer the input question, making the model perfectly precise in its ranking of relevant and irrelevant nodes in the retrieval context.",
Contextual Precision,1.0,Llama-3 70B,"The score is 1.00 because the relevant node at rank 1 provides a direct answer to the question, while the irrelevant nodes at ranks 2-10 do not provide information about the degrees a wheeled vehicle can achieve, with reasons such as ",
Contextual Precision,0.25,Llama-3 70B,"The score is 0.25 because the relevant node at rank 4 is ranked higher than only 1 out of 8 irrelevant nodes. The irrelevant node at rank 1 should be ranked lower since it does not address the angle of the ramp breakover directly, and the irrelevant nodes at ranks 2 and 3 should also be ranked lower since they do not mention ramp breakover angle. Meanwhile, the relevant node at rank 4 directly addresses the question by stating the ramp breakover angle requirement, but it is not ranked high enough compared to the other irrelevant nodes, which is why the score is not higher.",
Contextual Precision,0.08333333333333333,Llama-3 70B,"The score is 0.08 because the first 12 nodes in the retrieval context are irrelevant nodes, with reasons such as ",
Contextual Precision,0.125,Llama-3 70B,"The score is 0.12 because the irrelevant nodes, such as node 1, 2, 3, 4, 5, 6, and 7, are ranked higher than relevant nodes, like node 8. Node 8 clearly defines relative pointing error, whereas nodes 1-7 are not related to the concept of relative pointing error. This results in a low contextual precision score, indicating that the model is not effectively ranking relevant nodes higher than irrelevant ones.",
Contextual Precision,1.0,Llama-3 70B,"The score is 1.00 because all the irrelevant nodes in the retrieval context are correctly ranked lower than the relevant node, which is ranked 1st, directly answering the question about the absolute measurement error. The irrelevant nodes, ranked 2-10, are all discussing unrelated topics, making it easy to distinguish between relevant and irrelevant information, resulting in a perfect contextual precision score.",
Contextual Precision,0.16666666666666666,Llama-3 70B,"The score is 0.17 because the first five nodes in the retrieval context, which are irrelevant to the input, are ranked higher than the relevant node, which is ranked sixth. The irrelevant nodes have reasons such as ",
Contextual Precision,0.2159090909090909,Llama-3 70B,"The score is 0.22 because only 2 out of 15 nodes in the retrieval context are directly related to re-acquiring sun pointing of the solar arrays, and they are ranked 4th and 11th, respectively. The irrelevant nodes, such as node 1 discussing document number and issue/rev number, node 2 discussing attitude control, and node 3 discussing thruster operations, are ranked higher than the relevant nodes, which negatively impacts the contextual precision score. However, the relevant nodes do contain quotes that directly address re-acquiring sun pointing, such as",
Contextual Precision,0.0,Llama-3 70B,"The score is 0.00 because all nodes in the retrieval context are irrelevant to the input, with the first node stating ",
Contextual Precision,1.0,Llama-3 70B,"The score is 1.00 because all the relevant nodes, like the first node, which clearly states the Rosetta spacecraft will orbit the comet Wirtanen, are ranked higher than the irrelevant nodes, like the second, third, fourth, fifth, sixth, seventh, and eighth nodes, which do not mention anything about orbiting the comet Wirtanen, thus achieving perfect contextual precision.",
Contextual Precision,0.25,Llama-3 70B,"The score is 0.25 because the top-ranked nodes in the retrieval context are irrelevant to the input, with the first three nodes providing general information about the mission and its phases without specifying a number of asteroids that will be passed close to the spacecraft. The relevant node is ranked fourth, which reduces the contextual precision score. If the relevant node were ranked higher, the score would be higher, but the presence of many irrelevant nodes at the top of the ranking list brings the score down to 0.25.",
Contextual Precision,1.0,Llama-3 70B,"The score is 1.00 because all the relevant nodes in the retrieval context, such as the first node stating",
Contextual Precision,0.75,Llama-3 70B,"The score is 0.75 because the first and fourth nodes in the retrieval context, which are relevant to the input, are correctly ranked higher than the irrelevant nodes. However, the second and fifth nodes, which are not relevant, are ranked higher than they should be, bringing the score down. The third and sixth nodes, also not relevant, are correctly ranked lower, but there",
Contextual Precision,0.5,Llama-3 70B,"The score is 0.50 because the relevant node at rank 2 is correctly ranked higher than the irrelevant nodes at ranks 1 and 3, but the irrelevant node at rank 1 is not ranked lower than the relevant node, which would have resulted in a higher score. The reason for the ",
Contextual Precision,0.25,Llama-3 70B,"The score is 0.25 because the relevant node at rank 4 is ranked lower than the irrelevant nodes at ranks 1, 2, and 3, which do not mention the number of asteroids the spacecraft will pass, and instead discuss the scientific mission and orbital parameters. The model should have ranked the relevant node higher to achieve a higher score.",
Contextual Precision,1.0,Llama-3 70B,"The score is 1.00 because the only relevant node, ranked 1, provides a clear explanation of what is prohibited by the Rosetta programming standard, while all the irrelevant nodes, ranked 2-20, do not provide any information related to the standard or prohibited items, thus perfectly distinguishing between relevant and irrelevant nodes in the retrieval context ranking.",
Contextual Precision,0.4201923076923077,Llama-3 70B,"The score is 0.42 because the ranking of the nodes in the retrieval context is not optimal. The first node is relevant to the input, but then there are 5 irrelevant nodes ranked higher than the next relevant node at rank 7. The irrelevant nodes at ranks 2-6 do not contain any information related to the confidence level in the fly-by, as stated in their respective reasons, and should be ranked lower than the relevant nodes. The ranking improves later on, but the initial irrelevant nodes bring down the overall score.",
Contextual Precision,0.625,Llama-3 70B,"The score is 0.62 because the top-ranked node (rank 1) is relevant, but nodes ranked 2-5 are not, and then a relevant node is ranked 7, which indicates that the model is not consistently ranking relevant nodes higher than irrelevant nodes. The irrelevant nodes, such as node 2, which talks about ground communication via the HGA and solar power generation, should be ranked lower than the relevant nodes, such as node 1, which mentions the pointing error of the payload line of sight. The model should prioritize nodes that directly address the input question, like node 7, which mentions the relative pointing error of the payload line of sight, over nodes that are not relevant to the topic of payload line of sight or pointing error, like nodes 2-5 and 8-10.",
Contextual Precision,1.0,Llama-3 70B,"The score is 1.00 because the only relevant node in the retrieval context, ranked 1, directly addresses the question of confidence level in the asteroid fly-by phase, while all the irrelevant nodes, ranked 2-20, do not provide any information about the confidence level in the asteroid fly-by phase, resulting in a perfect ranking of relevant over irrelevant nodes.",
Contextual Precision,0.0,Llama-3 70B,"The score is 0.00 because all the nodes in the retrieval context are irrelevant to the input, with the first 12 nodes all having the reason ",
Contextual Precision,1.0,Llama-3 70B,"The score is 1.00 because the only node in the retrieval context is relevant to the input, and thus ranked first, as the text explicitly states the approval details of Rosetta by the ESA Science Programme Committee in November 1993 as Planetary Cornerstone mission of ESA’s long-term programme Horizon 2000, which perfectly matches the input query.",
Contextual Precision,0.14285714285714285,Llama-3 70B,"The score is 0.14 because most of the top-ranked nodes in the retrieval context are irrelevant to the input, with nodes 1-5 and 8-20 having ",
Contextual Precision,1.0,Llama-3 70B,"The score is 1.00 because all the relevant nodes in the retrieval context are ranked higher than the irrelevant nodes. The top two nodes in the retrieval context, ranked 1 and 2, are both ",
Contextual Precision,0.0,Llama-3 70B,"The score is 0.00 because all nodes in the retrieval context are irrelevant to the input, with the first node stating ",
Contextual Precision,1.0,Llama-3 70B,"The score is 1.00 because all irrelevant nodes, starting from the second node, are correctly ranked lower than the first node which is relevant to the input question ",
Contextual Precision,0.0,Llama-3 70B,"The score is 0.00 because there are no retrieval contexts provided, hence no nodes to rank and evaluate contextual precision score from. As a result, there are no irrelevant nodes to rank lower than relevant nodes, making the score 0.00.",
Contextual Precision,1.0,Llama-3 70B,"The score is 1.00 because all the irrelevant nodes are correctly ranked lower than the relevant node at rank 1, which directly answers the question of who shall provide engineering support of EC installations conducted by DND, and the answer is indeed the Contractor. The irrelevant nodes from rank 2 to 24 do not address the question at all, talking about disposal activities, Engineering Change Proposals, safety standards, and other unrelated topics, which is why they are correctly ranked lower than the relevant node. This perfect ranking results in a perfect score of 1.00.",
Contextual Precision,0.0,Llama-3 70B,"The score is 0.00 because there are no retrieval contexts provided, so no ranking is possible to evaluate precision.",
Contextual Precision,0.0,Llama-3 70B,"The score is 0.00 because all nodes in the retrieval context, including the first node, second node, and so on, are irrelevant to the input ",
Contextual Precision,1.0,Llama-3 70B,"The score is 1.00 because all the relevant nodes in the retrieval context are ranked higher than the irrelevant nodes, with the first node directly answering the question and the rest of the nodes not providing any relevant information to answer the question about the number of systems retrofitted to the Halifax-class Combat Systems, as they discuss unrelated topics or lack the required information.",
Contextual Precision,1.0,Llama-3 70B,"The score is 1.00 because all the irrelevant nodes are ranked lower than the relevant node at rank 1, which directly answers the question about what DND provides on the Contractor disposal management, which is oversight, as stated in the reason for the node at rank 1. This perfect ranking is a testament to the model",
Contextual Precision,0.25,Llama-3 70B,"The score is 0.25 because the first three nodes in the retrieval context, ranked 1, 2, and 3, do not provide the answer to the question, as they only list various requirements for the Contractor and RCN, but do not specify who is responsible for delivering training at DND facilities directly. The relevant node is ranked 4, which is too low, resulting in a low contextual precision score. The irrelevant nodes continue to dominate the top ranks, which further decreases the score.",
